id_plano_acao,id_executor,cnpj_executor,nome_executor,objeto_executor,vl_custeio_executor,vl_investimento_executor,uf_beneficiario_plano_acao
38154,938,76920818000194,MUNICIPIO DE SAO JOSE DA BOA VISTA,Contratação de empresa especializada para construção de arquibancada no Ginásio de Esportes Márcio Elizandro Faustino,0.0,100000.0,
36946,281,92410463000140,MUNICIPIO DE SAO JOSE DAS MISSOES,"Aquisição de dois veículos de passeio, no mínimo 5 lugares (cada um), para a secretaria municipal de Saúde (UBS), para serem utilizados pela equipe de saúde (ESF) em visitas domiciliares. ",0.0,150000.0,
14269,23222,07606478000109,MUNICIPIO DE GUARAMIRANGA,Serviços de custeio realizados pelo Castra movel,50000.0,0.0,
69111,19576,82926593000186,MUNICIPIO DE SANTA ROSA DE LIMA,Pavimentação com calçamento da Rua Paulina Schimdt Bairro Bela Vista,0.0,250000.0,
36552,1818,08308470000129,MUNICIPIO DE SAO VICENTE,"Pavimentação em Paralelepípedos do acesso a capela de São Francisco localizada no Sítio Saco Luiza, zona rural do município de São Vicente/RN.",0.0,400000.0,
36706,1809,08308470000129,MUNICIPIO DE SAO VICENTE,"Construção de Arena de Futebol Society Sintética, localizada na Serra de Santana, st baixa do sítio, zona rural do município de São Vicente/RN.",0.0,400000.0,
34776,2528,46523114000117,MUNICIPIO DE EMBU DAS ARTES,CONSTRUÇÃO DO PRONTO SOCORRO INFANTIL E MATERNIDADE,0.0,3000000.0,
16748,6788,56024581000156,MUNICIPIO DE RIBEIRAO PRETO,"Construção de quadra esportiva no bairro Vila Albertina, entre a rua Apeninos e rua Bahia, no Municipio de Ribeirão Preto, conforme peças técnicas anexadas",0.0,300000.0,
31162,25686,11097359000145,MUNICIPIO DE JOAO ALFREDO,Implantação de serviços e infraestrutura no município de João Alfredo,1000000.0,1900000.0,
20762,3116,48468284000171,MUNICIPIO DE GUARARAPES,Recapeamento asfáltico em ruas e avenidas do município de Guararapes/SP,0.0,80000.0,
12510,5466,01612343000170,MUNICIPIO DE RIACHAO DO BACAMARTE,"Reforma e ampliação do prédio da Secretaria Municipal de Saúde, aquisição de terrenos e aquisição de caminhão basculante        
",0.0,1000000.0,
69718,25806,88254909000117,MUNICIPIO DE IVOTI,Pavimentação de via urbana,0.0,300000.0,
13527,5904,45371820000128,MUNICIPIO DE SERTAOZINHO,"Obras de execução do sistema de drenagem de águas pluviais da região da Estrada Antônio Sarti - galerias, bueiros e canais, neste município e comarca de Sertãozinho, estado de São Paulo.",0.0,1000000.0,
38767,2559,88847082000155,MUNICIPIO DE GRAMADO,"PAVIMENTAÇÃO ASFÁLTICA DA ESTRADA LINHA TAPAERA - T5, NO MUNICIPIO DE GRAMADO, Estrada vicinal rural, com projeto de pavimentação de 2680 metros de comprimento e 7 metros de largura.",0.0,1000000.0,
12245,2454,01605479000152,MUNICIPIO DE BALNEARIO ARROIO DO SILVA,"Execução da reconstrução das Paredes Nortes e sul do Ginásio de Esportes Municipal, situado no bairro Golfinhos",0.0,500000.0,
71160,5242,01612334000189,MUNICIPIO DE JUNCO DO MARANHAO,CONSTRUÇÃO DO ESTADIO MUNICIPAL DE FUTEBOL,0.0,750000.0,
18552,17239,91103093000135,MUNICIPIO DE ARROIO DO SAL,Aquisição de equipamentos agrícolas e veículo utilitário,0.0,100000.0,
66835,1922,88702089000189,MUNICIPIO DE PANAMBI,Reforma ESF Centro no município de panambi. ,30000.0,100000.0,
36449,1822,08308470000129,MUNICIPIO DE SAO VICENTE,"Pavimentação em Paralelepípedos do acesso a Serra de Santana, zona rural do município de São Vicente/RN.",0.0,1000000.0,
19510,1533,03501509000106,MUNICIPIO DE CAMPO GRANDE,Construção de praça de esporte e lazer,0.0,1000000.0,
72401,1912,18348094000150,MUNICIPIO DE AIMORES,"OBRAS DE INFRA ESTRUTURA URBANA , RURAL E DIVERSOS , URBANISMO,  TRANSPORTE RODOVIARIO",0.0,490000.0,
70307,17354,12250163000101,MUNICIPIO DE BELO MONTE,"CONSTRUÇÃO DE QUADRAS E REFORMAS DE ESCOLAS,  REFORMA PRÉDIOS PÚBLICOS , PAVIMENTAÇÃO DIVERSAS, PASSAGEM MOLHADA ",0.0,300000.0,
74877,1704,87843819000107,MUNICIPIO DE FLORES DA CUNHA,"Substituir Rede de Drenagem e Repavimentar Rua Jhon Kennedy 
Pavimentar Estrada das Oliveiras 
Pavimentar Estrada Granja São Mateus",0.0,1650000.0,
33740,2882,94707627000120,MUNICIPIO DE MORRO REUTER,REFORMA DO GINÁSIO MUNICIPAL DE ESPORTES,0.0,500000.0,
64859,1139,10222297000193,MUNICIPIO DE RUROPOLIS,"
26.782.0007.1.027 - Construção, Ampliação e Recuperação de Ramais e Vias",150000.0,350000.0,
33807,1009,11368966000100,MUNICIPIO DE IGUARACI,PAVIMENTAÇÃO EM RUAS DO MUNICIPIO E INFRAESTRUTURA URBANA.,0.0,1478056.0,
18987,32045,01612538000110,MUNICIPIO DE BOA VISTA,"Construção do Núcleo de Atenção Integral da Saúde Mental - NAISM
Reforma e Requalificação do Mercado Público Municipal",0.0,500000.0,
22455,30852,77998904000182,SECRETARIA DE ESTADO DA CULTURA,Fomento da difusão cultural por meio de ações da Biblioteca Pública do Paraná.,0.0,200000.0,
31744,33397,13611913000196,FUNDO MUNICIPAL DE SAUDE,Aquisição de medicamentos e suporte as ações do MAC.,200000.0,0.0,
17073,29298,45226214000119,MUNICIPIO DE PINDAMONHANGABA,Aquisição de concreto asfáltico usinado à quente para diversas obras urbanas do Município de Pindamonhangaba.,0.0,500000.0,
37126,296,45780079000159,MUNICIPIO DE JARINU,Reforma do Ambulatório,0.0,2500000.0,
34867,5644,08867780000183,MUNICIPIO DE PILAR,"Implantação de Pavimentação em ruas e avenidas urbanas      
",0.0,100000.0,
31766,34146,01612545000111,MUNICIPIO DE BELAGUA,"- Serviços de execução da adequação e recuperação de estradas vicinais de interesse do município de Belágua-MA.
- Execução dos serviços de construção e recuperação de meio fio e sarjetas para o municipio de Belágua-MA. 
- Serviços prestados de limpeza e conservação (Roço Lateral) para atender as demandas da secretaria municipal de infraestrutura do município de Belágua",0.0,3214870.44,
11524,17030,82892316000108,MUNICIPIO DE PALHOCA,Castração de Animais ,100000.0,0.0,
17798,33398,24851461000136,MUNICIPIO DE DIVINOPOLIS DO TOCANTINS,"MANUTENÇÃO E REPARAÇÃO DE PRAÇAS, E JARDINS",0.0,200000.0,
16186,27463,18677625000158,MUNICIPIO DE ITAPEVA,"Meta 1 - Pavimentação da Travessa 1, no bairro Mandu perímetro urbano executado 978m². Meta 2 - Reforma da Rodoviária Municipal no centro de Itapeva/MG perímetro urbano executado estrutura, fechamento, alvenaria, pintura, porta de aço, 4.299,57m².
",0.0,309682.0,
31232,16135,01612812000150,MUNICIPIO DE SAO BERNARDINO,"Construção de Casa Mortuária, aquisição de mobiliário e equipamentos para a casa mortuária e aquisição de equipamentos para a Secretaria de Assistência Social.",0.0,300000.0,
68791,1530,83102806000118,MUNICIPIO DE RIO DOS CEDROS,Obras e Serviços de Engenharia,0.0,325000.0,
3257,12864,76978881000181,MUNICIPIO DE TERRA RICA,"Meta 1 – Materiais Básicos para Estrutura e Alvenaria
Descrição do Objeto:
Aquisição de materiais básicos para construção civil, incluindo: 635 sacos de cimento CP II-32 (50 kg), 15 m³ de areia média, 10 m³ de pedra britada, 45 unidades de cal hidratada CH-I (20 kg), 230 blocos cerâmicos e 465 kg de argamassa. Os materiais serão utilizados em obras de estrutura e alvenaria para edificações públicas no município de Terra Rica – PR.

Meta 2 – Cobertura e Calhas
Descrição do Objeto:
Aquisição de materiais para cobertura de edificações públicas, sendo: 230 m² de telha trapezoidal em aço zincado, 41 metros de comunheira para telha ondulada de zinco, 6 unidades de telha estrutural de fibrocimento (1,0 x 7,40m), 62 unidades de rufo externo de chapa de aço e 60 unidades de calha de chapa de aço. Os itens serão empregados em obras de cobertura e drenagem pluvial.

Meta 3 – Revestimentos Cerâmicos
Descrição do Objeto:
Fornecimento e aplicação de revestimentos cerâmicos, incluindo 23 m² de piso cerâmico para chão (45x45 cm, PEI ≥ A4) e 70 m² de revestimento cerâmico de parede (33x45 cm, PEI ≥ A3), totalizando 93 m². A ação visa o acabamento de ambientes internos em edificações públicas.

Meta 4 – Esquadrias de Alumínio
Descrição do Objeto:
Aquisição de esquadrias de alumínio para aplicação em edificações públicas: 01 janela maxim ar (80x60 cm) e 04 portas venezianas (87x210 cm). O objetivo é promover ventilação, iluminação e segurança adequadas aos espaços públicos.

Meta 5 – Instalações Hidrossanitárias (Tubos e Conexões)
Descrição do Objeto:
Aquisição de materiais hidrossanitários para instalações prediais, incluindo: tubos PVC DN 100mm (6m), curvas, luvas, tubos 25mm e 40mm (6m), joelhos e conexões tipo ""T"". Os itens garantirão o correto funcionamento das redes de água e esgoto em prédios públicos.

Meta 6 – Louças, Metais e Acessórios Sanitários
Descrição do Objeto:
Aquisição de itens sanitários para uso em banheiros públicos, sendo: 01 lavatório com coluna, 02 barras de apoio em inox (80 cm), 01 chuveiro 5500W, 01 torneira de mesa, 01 engate flexível, 01 sifão, 02 caixas d'água de 1000L, 04 ralos, 01 válvula e 01 registro de pressão. Os materiais visam garantir acessibilidade e funcionamento adequado das instalações sanitárias.

Meta 7 – Materiais de Concreto Pré-moldado
Descrição do Objeto:
Aquisição e aplicação de 1.361 metros de meio-fio pré-moldado de concreto (100x9x30 cm) e 1.810 m² de piso intertravado de concreto (20x10 cm, espessura de 6 cm, resistência 35MPa). Os materiais serão utilizados em obras de urbanização e pavimentação de vias e calçadas públicas.

Meta 8 – Grama Esmaltada em Placas (sem plantio)
Descrição do Objeto:
Fornecimento de 7.316 m² de grama esmaltada em placas, sem plantio, destinada a compor áreas verdes e paisagismo urbano em espaços públicos do município de Terra Rica – PR.

Meta 9 – Pintura de Ciclofaixa e Sinalização Viária
Descrição do Objeto:
Execução de pintura de ciclofaixa e sinalização viária horizontal na Avenida Ercília Martins Damiani, no município de Terra Rica – PR, abrangendo uma área de 4.887 m². A intervenção visa promover segurança no trânsito e estimular o uso de modais não motorizados.

Meta 10 – Pintura de Prédios Públicos
Descrição do Objeto:
Serviços de pintura externa e interna em prédios públicos, totalizando 5.306 m², incluindo: Prefeitura Municipal de Terra Rica (2.791 m²), Subprefeitura no distrito de Adhemar de Barros (585,36 m²), Rodoviária de Terra Rica (1.233,71 m²) e Rodoviária do Distrito de Adhemar de Barros (696,02 m²). O objetivo é revitalizar as fachadas e manter os edifícios em condições adequadas de uso.

Meta 11 – Pintura da Escola Municipal Rosalina de Morais
Descrição do Objeto:
Serviços de pintura da Escola Municipal Rosalina de Morais, localizada na Rua Barão do Rio Branco, nº 107, Centro – Terra Rica – PR, com área total de 6.867,26 m². A intervenção visa preservar o patrimônio público, melhorar o ambiente escolar e proporcionar um espaço mais agradável para alunos e professores.",300000.0,0.0,PR
19380,1292,81648859000103,MUNICIPIO DE BITURUNA,"Construção de passarelas metálicas
Pavimentação asfaltica
Reforma de Escola
Reforma de cobertura de Ginásio de Esportes
Pavimentação poliédrica
Adequação de Estradas
Aquisição de imóveis",0.0,8800000.0,
65791,9526,01343086000118,MUNICIPIO DE SERRANOPOLIS,"Construção de uma ponte no perímetro urbano - Rua Horácio Francisco de Souza Setor central Ponte sobre o córrego moranga, denominada ponte do Samita - Comprimento:6 metros
Largura: 9 metros
Altura: 4,5 metros""
",0.0,400000.0,
73239,2232,88830609000139,MUNICIPIO DE CAXIAS DO SUL,Execução de capital no Município de Caxias do Sul,0.0,850000.0,
17343,407,76208818000166,MUNICIPIO DE GUARANIACU,Aquisição de caçambas de entulhos e de lixeiras,0.0,200000.0,
21834,1992,82575812000120,MUNICIPIO DE PORTO BELO,"Aquisição de Retroescavadeira, Tipo A, para atender a Secretaria de Agricultura e Pecuária, no Município de Porto Belo/SC.",0.0,100000.0,
72851,1534,83102475000116,MUNICIPIO DE GUARAMIRIM,Aquisição de Equipamentos e Materiais para atendimento Hospitalar e Ambulatorial,0.0,100000.0,
64967,13427,11097359000145,MUNICIPIO DE JOAO ALFREDO,"Infraestrutura /Pavimentação de ruas do município de João Alfredo
Festejos Juninos e Festival de Cultura de João Alfredo",450000.0,1000000.0,
38696,1891,30984161000128,FUNDO MUNICIPAL DE EDUCACAO - FME,Contratação de empresa especializada em construção de subestação nas Unidades Escolares Madre Tereza de Calcutá e Chapeuzinho Vermelho,0.0,200000.0,
70768,1333,89708051000186,MUNICIPIO DE FORTALEZA DOS VALOS,"Obra de revitalização da Praça Municipal 03 de Maio, localizada em perímetro urbano, entre as ruas João XXIII, Libreloto, Rubert e Pe. Paulo Bortoline., construção de banheiros, iluminação externa canteiros centrais e quadra society.",0.0,305000.0,
30975,10452,18186718000180,MUNICIPIO DE ITANHANDU,"Aquisição dos equipamentos para composição da sala de integração sensorial da APAE - Associação de Pais e Amigos dos Excepcionais de Itanhandu-MG, inscrita no CNPJ 17.904.913/0001-35, 
",0.0,100000.0,
4386,21637,83102426000183,MUNICIPIO DE DONA EMMA,Aquisição de Pá Carregadeira,0.0,300000.0,
72590,12369,01613619000134,MUNICIPIO DE TUPIRAMA,OBRAS - CALÇAMENTO VIAS PÚBLICAS E AMPLIAÇÃO PALCO DA FEIRA COBERTA,0.0,700000.0,
20013,1454,83169623000110,MUNICIPIO DE JOINVILLE,"Asfaltamento Rua Major Navarro "" da Rua Paraíba Até Rua Rio Grande do Sul, Bairro Anita Garibaldi"" - Joinville/SC",0.0,400000.0,
69950,943,76208867000107,MUNICIPIO DE CASCAVEL,Adquirir equipamentos e material permanentes para as escolas ,0.0,300000.0,
9980,31805,04653408000113,MUNICIPIO DE CARACARAI,AQUISIÇÃO DE CESTA BÁSICA ,920998.0,0.0,
32570,33402,24851461000136,MUNICIPIO DE DIVINOPOLIS DO TOCANTINS,MANUTENÇÃO DA SECRETARIA DE GESTÃO AMBIENTAL,200051.0,0.0,
31228,33401,01614826000103,MUNICIPIO DE PAULISTANIA,AQUISIÇÃO DE MEDICAMENTOS.,200000.0,0.0,
15191,1737,01613731000175,MUNICIPIO DE LAGOA GRANDE,CONSTRUÇÃO DE PRAÇA PADRÃO NO BAIRRO MORADA NOVA.,0.0,500000.0,
36086,17031,88756879000147,MUNICIPIO DE SAO FRANCISCO DE PAULA,Aquisição de Ambulância para utilização do Corpo de Bombeiros municipal nos atendimentos e remoções.,0.0,300000.0,
74904,953,91110296000159,MUNICIPIO DE NOVA ROMA DO SUL,Pavimentação Asfáltica da Linha Carlos Leopoldo.,0.0,400000.0,
36952,3460,04190765000192,MUNICIPIO DE EIRUNEPE,CONSTRUÇÃO DE UNIDADES BÁSICAS DE SAÚDE,0.0,442245.0,
17515,2839,02070571000128,MUNICIPIO DE LIZARDA,Infraestrutura,0.0,150000.0,
67822,1670,05105200000122,MUNICIPIO DE MUANA,EXECUÇÃO DE TERRAPLANAGEM EM VIAS PÚBLICAS NO MUICÍPIO DE MUANÁ/PA,0.0,1000000.0,
70888,1685,88830609000139,MUNICIPIO DE CAXIAS DO SUL,Execução de capital no Município de Caxias do Sul,0.0,300000.0,
67495,2783,01612986000113,MUNICIPIO DE LOGRADOURO,"Pavimentação em vias urbanas
Pavimentação em diversas comunidades da zona rural
Canteiros",0.0,500000.0,
22185,1741,83169623000110,MUNICIPIO DE JOINVILLE,Obras de infraestrutura urbana,0.0,1500000.0,
71529,284,76208867000107,MUNICIPIO DE CASCAVEL,"- Aquisição de Equipamentos para as Escolas Municipais 
- Reformar Espaços Esportivos e de Lazer",0.0,250000.0,
34181,1753,83169623000110,MUNICIPIO DE JOINVILLE,Aquisição de Equipamentos e Materiais Permanentes,0.0,500000.0,
10842,14686,46638714000120,MUNICIPIO DE TREMEMBE,"DRENAGEM URBANA E PAVIMENTAÇÃO NA RUA 45, GLEBSA B NO JARDIM MARACAIBO B",0.0,300000.0,
12387,6253,02056737000151,MUNICIPIO DE QUIRINOPOLIS,"Construção de um Centro de Distribuição do Município de Quirinópolis (Via Leocadio de Souza Reis, Km-01 - Jardim Primavera - Município de Quirinópolis-GO.)

 CONTRATAÇÃO DE APRESENTAÇÃO ARTÍSTICA COM ATRAÇÃO MUSICAL DO CANTOR PADRE ALESSANDRO
CAMPOS ATRAVÉS DA EMPRESA IVAN JUNIOR PRODUÇÕES ARTÍSTICAS LTDA, PARA A REALIZAÇÃO DE SHOW DURANTE O
FESTIVAL NORDESTINO 2023

",100000.0,600000.0,
65465,810,03124410000132,FUNDACAO DE CULTURA E COMUNICACAO ELIAS MANSOUR,Festival Estadual da Canção 2025.,800000.0,0.0,
13333,27462,18017442000106,MUNICIPIO DE BRASILIA DE MINAS,"PAVIMENTAÇÃO DE VIA PÚBLICA, TRECHO QUE DÁ ACESSO AO DISTRITO DE FERNÃO DIAS",0.0,100000.0,
37965,959,30417158000122,MUNICIPIO DE ITALVA,"Urbanização da Rua Julia Conceição Nunes (parcial)
Aditivo de Obra de Urbanização da Rua Julia Conceição Nunes
Urbanização Rua Fidelis Crispim e Nicanor da Silva",0.0,2000000.0,
71347,1672,08927105000100,MUNICIPIO DE ARARUNA,Aquisição de Equipamentos para saúde,0.0,450000.0,
66330,3778,11361896000150,MUNICIPIO DE SAO VICENTE FERRER,INFRAESTRUTURA URBANA,600000.0,0.0,
4197,3194,44428506000171,MUNICIPIO DE ANDRADINA,EXECUÇÃO DE DRENAGEM DE AGUAS PLUVIAIS,0.0,150000.0,SP
66656,11968,18303180000146,MUNICIPIO DE CONGONHAS DO NORTE,PAGAMENTO DE DESPESAS DO MUNICIPIO,100000.0,0.0,
67734,945,17349848000123,MUNICIPIO DE MOJUI DOS CAMPOS,"-APOIO E INCENTIVO AS MANIFESTAÇÕES CULTURAIS
-IMPLEMENTAÇAÕ DE AÇÕES DE INFRAESTRUTURA RURAL",800000.0,0.0,
36332,2663,45786159000111,MUNICIPIO DE IRACEMAPOLIS,"EXECUÇÃO DE OBRAS E BENFEITORIAS NO SISTEMA DE SANEAMENTO DO MUNICÍPIO, BEM COMO DE MANUTENÇÃO DO SISTEMA VIÁRIO.",0.0,3400000.0,
37827,28637,49556863000139,MUNICIPIO DE IPUA,Execução de Recomposição de Pavimento asfáltico em Ruas e Avenidas no perímetro urbano de Ipuã/SP.,0.0,400000.0,
72863,19917,82577636000165,MUNICIPIO DE TIJUCAS,"Construção de Quadra de Beach Tennis, na área urbana do município de Tijucas-SC.",0.0,150000.0,
70497,13191,18083071000160,MUNICIPIO DE FELISBURGO,Pavimentação de Vias Públicas,0.0,250000.0,
31139,18575,04332995000149,MUNICIPIO DE CAREIRO,"IMPLANTAÇÃO DE SISTEMA DE ABASTECIMENTO ÁGUA NA COMUNIDADE CINTURÃO VERDE NO MUNICÍPIO DE CAREIRO/AM,",0.0,1475186.0,
65955,13422,11097359000145,MUNICIPIO DE JOAO ALFREDO,"Festejos Juninos e Festival de Cultura de João Alfredo
Infraestrutura e Construção de área de lazer no entorno do Ginásio Poliesportivo Djair Santos ",150000.0,350000.0,
74007,27091,80913031000172,MUNICIPIO DE OURO VERDE,Aquisicao de Rolocompactador,0.0,200000.0,
20788,5428,46137485000160,MUNICIPIO DE DUARTINA,RECAPEAMENTO ASFÁLTICO,0.0,50000.0,
68637,4687,05995766000177,MUNICIPIO DE MACAPA,Termo de Fomento com Associação Amapaense de Apoio aos Pacientes em tratamento fora de domicílio  (AAPTFD) custeio das atividades de assistência a saúde oftalmológica dos associados.,200000.0,0.0,
9856,11940,17947631000115,MUNICIPIO DE ANTONIO PRADO DE MINAS,"Pavimentação de uma área de 4.800,00 m2 do Parque de Exposição Lourival Pereira Metello de Antônio Prado de Minas.
Localizado em área urbana do município.
Obra concluída.",0.0,180000.0,
18655,33399,24851461000136,MUNICIPIO DE DIVINOPOLIS DO TOCANTINS,"MANUTENÇÃO DE PRAÇAS, PARQUES E JARDINS",0.0,250000.0,
35336,29423,87613550000164,MUNICIPIO DE SAO JOSE DO OURO,"Contratação de empresa para execução, em regime de empreitada global, de um
Espaço Recreativo Infantil, na Travessa Montauri José de Paula, Centro, para uso dos alunos
da EMEI Profa Maria Helena Morelo; Contratação de empresa para construção, em regime de empreitada global, da perfu-
ração e instalação de um poço tubular profundo a ser executado na Localidade de Linha Ma-
chado, zona rural do município de São José do Ouro",0.0,300000.0,
70752,6004,92465210000173,MUNICIPIO DE DOUTOR MAURICIO CARDOSO,"Contratação de empresa especializada para pavimentação asfáltica e sinalização em vias do município, a serem executados em regime de empreitada (material e mão de obra), conforme especificações técnicas detalhadas no memorial descritivo, plantas, minuta de contrato, cronograma físico-financeiro e demais documentos anexos ao presente edital. PAVIMENTAÇÃO ASFÁLTICA - CBUQ e sinalização em trechos da RUA URUGUAI  (trecho até o cemitério) , conforme Plano de Ação nº 09032024-2-070752 / 2024  – Ministério da Fazenda",0.0,200000.0,
18961,28560,06769798000117,MUNICIPIO DE BARRA DO CORDA,RECUPERAÇÃO DE ESTRADAS VICINAIS,0.0,600000.0,
10790,30245,32512501000143,MUNICIPIO DE VOLTA REDONDA,"aquisição de COMPACTADOR (ROLO VIBRATÓRIO COMPACTADOR DE SOLO TANDEM LISO, NOVO, ZERO KM, MOTOR BRANCO A COMBUSTÃO, POTÊNCIA A PARTIR DE 10 HP, COMBUSTÍVEL DIESEL OU GASOLINA, PESO OPERACIONAL MÁXIMO DE 2000 KG, CAPACIDADE DE TANQUE DE COMBUSTÍVEL DE ATÉ 30 LITROS, CAPACIDADE DO TANQUE DE ÁGUA DE ATÉ 150 LITROS; FREQUÊNCIA DE VIBRAÇÃO MÁXIMO DE 65 HZ, DIMENSÃO DO CILINDRO MÁXIMO DE 1171 X 575 MM, GARANTIA INTEGRAL PARA O EQUIPAMENTO MÍNIMO DE 12 (DOZE) MESES SEM LIMITES DE HORAS TRABALHADAS) - (Unidade: UNIDADE)",0.0,150000.0,
73209,960,00007914000184,MUNICIPIO DE ARENOPOLIS,Infraestrutura Urbana no município de Arenópolis,0.0,500000.0,
21208,33400,24851461000136,MUNICIPIO DE DIVINOPOLIS DO TOCANTINS,"MANUTENÇÃO DE PRAÇAS, PARQUES E JARDINS",0.0,150000.0,
31222,1404,53415717000160,MUNICIPIO DE OURINHOS,EXECUÇÃO DE MELHORIAS PARA INFRAESTRUTURA DO MUNICÍPIO,0.0,750000.0,
3247,1897,08113466000105,MUNICIPIO DE LAJES,Pavimentação e recuperação de vias no município de Lajes/RN,0.0,250000.0,RN
67457,961,88488358000156,MUNICIPIO DE NOVA PALMA,Realização de Obra e Material de Consumo para o Município de Nova Palma.,60000.0,140000.0,
64662,12202,16245375000151,MUNICIPIO DE BONITO,Pavimentação de vias publicas e Construção de Unidade Escolar no Município de Bonito - BA,0.0,800000.0,
75078,1512,82765488000102,MUNICIPIO DE TAIO,"Pavimentação, Sinalização Viária e Urbanização da Rua Raulino Gerber.",0.0,400000.0,
69979,13378,08096596000187,MUNICIPIO DE TIMBAUBA DOS BATISTAS,"Conclusão de Pavimentação da Rua Joaquim de Araújo Pereira, localizada na zona urbana do Município de Timbaúba dos Batistas.",0.0,50000.0,
14315,27991,18715391000196,MUNICIPIO DE BETIM,Custear os serviços socioassitênciais das proteções básica e especial do Município. ,200000.0,0.0,
13385,1807,05421300000168,MUNICIPIO DE SAO FELIX DO XINGU,"Aquisição de um  kit rompedor hidráulico, com engate rápido para uma retroescavadeira e um braço hidráulico com engate para mini carregadeira, para atender as demandas  da secretaria municipal de Urbanismo.   ",0.0,120000.0,
67863,1894,08096612000131,MUNICIPIO DE SAO FERNANDO,CONSTRUÇÃO DE PRÉDIO PÚBLICO MUNICIPAL,0.0,350000.0,
69598,10472,18715532000170,POLICIA CIVIL DO ESTADO DE MINAS GERAIS,Equipamentos para estruturação da 3ª Delegacia Regional da Polícia Civil em São João Del Rey/MG.,0.0,100000.0,
21058,27638,18242792000176,MUNICIPIO DE POCO FUNDO,OBRAS E SERVIÇOS URBANOS,0.0,100000.0,
36454,8214,05735244000136,SECRETARIA ESTADUAL PARA INCLUSAO DA PESSOA COM DEFICIENCIA - SEID,"1 - Construção de Panificadora - Paulistana; 
2 - Aquisição de Academias de Saúde;

",0.0,2032698.0,
36454,29005,06553564000138,PIAUI SECRETARIA DE SAUDE,Construção de Centro Especializado às pessoas com Espectro do autismo ,0.0,5000000.0,
72245,9016,05058458000115,MUNICIPIO DE BARCARENA,Execução de obras de Drenagem ubrana no Município de Barcarena-PA.,0.0,500000.0,
71509,10446,76402882000183,MUNICIPIO DE JANIOPOLIS,Pavimentação Poliédrica na estrada do Takao no município de Janiópolis,0.0,150000.0,
67541,16425,09072448000195,MUNICIPIO DE NATUBA," 2ª etapa da  requalificação do Hospital e Unidade de Saúde Centro de Natuba
",0.0,400000.0,
9256,5969,08999674000153,MUNICIPIO DE SOUSA,"Requalificação e ampliação da Avenida Monsenhor Vicente de Freitas e aquisição e implantação de luminárias em LED, visando a modernização da iluminação pública na saída de Sousa para São Gonçalo, BR 230, no Perímetro Urbano do município de Sousa.
",0.0,3000000.0,
72966,1526,01612885000142,MUNICIPIO DE VARGEM GRANDE DO RIO PARDO,Pavimentação Asfaltica em CBUQ na Avenida Belo Horizonte Via Urbana no Municipio de Vargem Grande do Rio Pardo,0.0,400000.0,
68416,11843,04588596000143,MUNICIPIO DE JURUA,AQUISIÇÃO DE PAINEIS SOLARES PARA O MUNICIPIO DE JURUA/AM,0.0,1000000.0,
67097,1814,88830609000139,MUNICIPIO DE CAXIAS DO SUL,Execução de obra em escola de ensino fundamental no Município de Caxias do Sul,0.0,500000.0,
34127,2725,46523262000131,MUNICIPIO DE GUARAREMA,"REFORMA E EXECUÇÃO DE UNIDADE DE SAÚDE;
EXECUÇÃO DE OBRA DE READEQUAÇÃO DAS INSTALAÇÕES DA SEDE DO CORPO DE BOMBEIROS.
EXECUÇÃO DE OBRA DE REFORMA E ADEQUAÇÃO DO CENTRO DE SEGURANÇA INTEGRADA - CSI",0.0,2000000.0,
33021,1423,92902055000105,MUNICIPIO DE SAO VALENTIM DO SUL,"pavimentação urbana em bloco de concreto intertravado na Rua Dilnei Roque Bassani com área de 1.483,24m2. ",0.0,200000.0,
72368,3030,75680025000182,MUNICIPIO DE PALMITAL,Obra de Infraestrutura junto a Feirinha Municipal - Cobertura,0.0,130000.0,
75055,1386,95952230000167,MUNICIPIO DE BRACO DO TROMBUDO,CONSTRUÇÃO DO MURO DA ESCOLA NUCLEADA NA LOCALIDADE KM 20 E CONSTRUÇÃO DO CEMITÉRIO NA LOCALIDADE KM 15,0.0,400000.0,
33722,1582,80874100000186,MUNICIPIO DE BOM SUCESSO DO SUL,"CONSTRUÇÃO DE PISCINA MUNICIPAL, CONTEMPLANDO VESTIÁRIOS, BANHEIROS E ARQUIBANCADA, TOTALIZANDO ÁREA CONSTRUÍDA DE 780,85M²",0.0,1000000.0,
20375,27640,17754110000141,MUNICIPIO DE SENADOR MODESTINO GONCALVES,"AQUISIÇÃO DE 01 COLHEDORA DE FORRAGEM
INSTALAÇÃO DE ILUMINÁRIAS E POSTES PUBLICOS - INFRAESTRUTURA URBANA",0.0,100000.0,
3724,23753,18116160000166,MUNICIPIO DE PARAOPEBA,Canalização do Córrego do Beco,0.0,500000.0,MG
15572,25645,24179426000112,MUNICIPIO DE LAMIM,ações de custeio,50000.0,0.0,
33945,5999,01612532000142,MUNICIPIO DE PARARI,"Construção de Parque Infantil na Rua João Gomes Filho, Centro, Zona Urbana - Parari-PB.",0.0,300000.0,
68461,17746,45299104000187,MUNICIPIO DE BATATAIS,Reforma e ampliação da EMEB José Virgílio Braghetto.,0.0,300000.0,
