id_plano_acao,id_executor,cnpj_executor,nome_executor,objeto_executor,vl_custeio_executor,vl_investimento_executor,uf_beneficiario_plano_acao
65734,12939,00003848000174,MUNICIPIO DE FIGUEIROPOLIS,"
1- AQUISIÇÃO DE PEÇAS E SERVIÇOS PARA MANUNTEÇÃO PREVENTIVA E CORRETIVA DAS MAQUINAS E VEICULOS DA FROTA DO MUNICIPIO(AQUISIÇÃO DE PEÇAS PARA MAQUINAS PESADAS E VEÍCULOS DA MARCA: CATERPELLAR, FIAT ALLIS, MASSEY FERGUSON, CASE,MERCEDES, WOLKS, FORD, FIAT, CHEVROLET, XT870BR-1, XCMG e LW300KV",200000.0,0.0,
36393,4824,45131885000104,MUNICIPIO DE JALES,Reforma do SACRA,0.0,200000.0,
3434,27174,78497492000160,MUNICIPIO DE TIMBO GRANDE,CONSTRUÇÃO DE CALÇADAS EM TRECHO DA RUA SÃO JOSÉ,0.0,150000.0,SC
31209,3742,45547395000185,MUNICIPIO DE IACRI,"Investimento - Reforma da Unidade de Pronto Atendimento.

Custeio - Desporto e Lazer",100000.0,500000.0,
72604,2873,25061722000187,MUNICIPIO DE BURITI DO TOCANTINS,PAVIMENTAÇÃO DE BLOQUETES SEXTAVADO NO BAIRRO BURITINOPOLIS,0.0,600000.0,
33448,16040,75457341000190,MUNICIPIO DE JAGUAPITA,"1) CONTRATAÇÃO DE EMPRESA DE ENGENHARIA PARA EXECUÇÃO DE SERVIÇOS DE CONSTRUÇÃO DE PONTE EM CONCRETO ARMADO E PRÉ-MOLDADO, NA ESTRADA ÁGUA DA ONÇA – KM 1 (PONTE DA VILA RURAL) DO MUNICÍPIO DE JAGUAPITÃ – PR.

2) AQUISIÇÃO E INSTALAÇÃO DE PARQUINHOS E PLAYGROUNDS EM PRAÇAS PÚBLICAS DO MUNICIPIO.
",0.0,500000.0,
35649,29335,13885231000171,MUNICIPIO DE ESPLANADA,Aquisição de veículos e Construção de Passagem Molhada,0.0,500000.0,
67153,1489,87612909000189,MUNICIPIO DE PALMITINHO,Reforma do Ginásio Municipal de Esportes Eurico Piaia,0.0,150000.0,
73688,15671,01612496000117,MUNICIPIO DE GLAUCILANDIA,Pavimentação asfáltica,0.0,300000.0,
3431,21140,82558149000155,MUNICIPIO DE GRAO PARA,"AMPLIAÇÃO DO C.E.I. TIO PATINHAS COM A CONSTRUÇÃO DE DUAS SALAS E DE UM MURO DE ARRIMO, LOCALIZADO NO CENTRO DO MUNICÍPIO DE GRÃO-PARÁ/SC.",0.0,100000.0,SC
37493,31242,01612370000142,MUNICIPIO DE CATAS ALTAS,"EXECUÇÃO DE PAVIMENTO COM APLICAÇÃO DE CONCRETO ASFÁLTICO, CAMADA DE ROLAMENTO - EXCLUSIVE CARGA E TRANSPORTE",0.0,400000.0,
67889,703,02056737000151,MUNICIPIO DE QUIRINOPOLIS,"Construção e melhoria da infraestrutura urbana no Bairro Jardim Paraíso, incluindo a execução de galerias de águas pluviais, pavimentação asfáltica, meio-fio e sarjeta numa área de 41.032,68 m², no Município de Quirinópolis-GO,",0.0,1500000.0,
21798,637,88587183000134,MUNICIPIO DE CARLOS BARBOSA,"Construção urbana de um pavilhão coberto em concreto pré-moldado para finalidade de depósito geral da Secretaria de Segurança e Trânsito, localizado na Rua Antonio Prado, n º 382, bairro Navegantes, no município de Carlos Barbosa (RS).",0.0,300000.0,
32253,2248,10287373000149,MUNICIPIO DE BETANIA,"
10-Saúde / 301-Atenção Básica
Excluir
15-Urbanismo / 451-Infraestrutura Urbana
Excluir
17-Saneamento / 512-Saneamento Básico Urbano",0.0,500000.0,
19586,22794,12228375000192,MUNICIPIO DE IGACI,"0016 - SECRETARIA MUNICIPAL DE INFRAESTRUTURA - SEINFRA
15.451.0008.1011 - CONSERVAÇÃO, ALARGAMENTO E PIÇARRAMENTO DE ESTRADAS VICINAIS
Recuperação, regularização, picarramento, compactação e ampliação de estradas vicinais do Sítio Travessão, Sítio Abóbora, Sítio Emboscada, Sítio Lontra na Zona Rural do Município de Igaci/AL",0.0,600000.0,
65735,12863,24851479000138,MUNICIPIO DE MARIANOPOLIS DO TOCANTINS,Manutenção dos serviços administrativos da Prefeitura de Marianópolis do Tocantins - TO,150000.0,0.0,
14970,24155,13845086000103,MUNICIPIO DE SERRINHA,Execução de obras de Saneamento Básico Urbano e Execução de custeio da Saúde/Pavimentação Asfáltica,100000.0,200000.0,
31208,690,44563591000180,MUNICIPIO DE BERNARDINO DE CAMPOS,Investimento - reforma da rodoviária municipal    - Custeio - Festa do Peão de Boiadeiro 2023 contratação estrututura ,100000.0,200000.0,
36596,18491,01612388000144,MUNICIPIO DE ARAPUA,PAVIMENTAÇÃO DE VIAS URBANAS EM CBUQ NO MUNICÍPIO DE ARAPUÃ-PR.,0.0,133144.0,
17955,20817,18338186000159,MUNICIPIO DE LIMA DUARTE,Calçamento da rua Altamir Pacheco; Aditivo para viabilizar a finalização da Cheche do Horto; Aditivo para fechamento com tapume na obra de construção da capela mortuária no distrito de manejo ; Aditivo para Finalização do campo de futebol ,0.0,200000.0,
67787,743,02029957000196,MUNICIPIO DE JOVIANIA,"Pista de cooper /reforma Estádio/Infra
",0.0,1000000.0,
69489,1982,87896874000157,MUNICIPIO DE ALEGRETE,Repasse para instituições de esporte e lazer e aquisição de aparelho para controle de produtos de origem animal,0.0,350000.0,
72187,1642,01612215000126,MUNICIPIO DE NOVA IPIXUNA,"CONSTRUÇÃO DE BEBEDOUROS COMUNITÁRIOS NAS LOCALIDADES: VILA BOA ESPERANÇA (KM 41); BAIRRO JERUSALÉM (ZONA URBANA) E NA VILA VITÓRIA (ZONA RURAL), NO MUNICÍPIO DE NOVA IPIXUNA/PA.",0.0,300000.0,
74514,10320,05487631000109,SECRETARIA DE ESTADO DE JUSTICA E SEGURANCA PUBLICA -SEJUSP,Aparelhamento do Presídio de Bicas - 4ª Região Integrada de Segurança Pública (RISP),0.0,510250.0,
70038,5425,01135904000197,MUNICIPIO DE RIALMA,"OBJETO: AQUISIÇÃO DE INSUMOS PARA PACIENTES PORTADORES DE DIABETES, VISANDO O ATENDIMENTO AS NECESSIDADES DO FUNDO MUNICIPAL DE SAÚDE.
DOTAÇÃO ORÇAMENTARIA: 10.15.15.451.0310.1.049 - 4.4.90.51- FICHA 277",0.0,70000.0,
17619,2883,08097008000120,MUNICIPIO DE ACARI,"- Reforma do Clube Municipal
- Reforma da Feira Livre",0.0,459682.0,
68845,4498,83102343000194,MUNICIPIO DE BRUSQUE,Aquisição de equipamentos para a Secretaria de obras,0.0,50000.0,
35562,33394,94444189000155,MUNICIPIO DE VILA NOVA DO SUL,Construção de quadra poliesportiva na praça Sinval Saldanha,0.0,180000.0,
38428,2218,83169623000110,MUNICIPIO DE JOINVILLE,Pavimentação de vias,0.0,2525274.0,
12257,23202,76017474000108,MUNICIPIO DE GUARATUBA,"Execução e implantação de pavimentação em concreto betuminoso
Serviços  de manutenção viaria",0.0,1000000.0,
41522,28886,24301475000186,MUNICIPIO DE SANTA CRUZ,Implementar ações de manutenção dos serviços básicos.,150000.0,0.0,
74205,31370,11361250000173,MUNICIPIO DE SERRITA,"CONSTRUÇÃO DE PRAÇAS, PASSEIOS E CONTENÇÕES NO TREVO E ACESSO DO SÍTIO CARACOL .",0.0,500000.0,
38064,2963,46200846000176,MUNICIPIO DE LENCOIS PAULISTA,Recapeamento asfálticos de diversas vias localizadas na área urbana do município de Lençóis Paulista,0.0,750000.0,
69095,10653,82939455000131,MUNICIPIO DE IRANI,"R$ 200.000,00 - 27-Desporto e Lazer / 812-Desporto Comunitário - Contratação de empresa especializada, no regime de Empreitada Global para execução de serviços de reforma do Ginásio Municipal Modesto Tortelli que compreende a instalação de assentos esportivos, execução de instalações elétricas novas, limpeza e impermeabilização com manta asfáltica aplicada sobre a cobertura metálica, substituição de calhas e rufos metálicos, concerto de fissuras nas calhas de concreto e pintura internas e externa da edificação, de acordo com projeto, memorial descritivo e planilha orçamentária anexos a este termo.   
R$ 400.000,00 - 26-Transporte / 782-Transporte Rodoviário - AQUISIÇÃO DE CAMINHÃO VOLKSWAGEN CONSTELLATION 31.320 – 2024/2025, CAMINHÃO TIPO H (COM TRAÇÃO 6X4, CHASSI, 12 (DOZE) MARCHAS AVANTE E 2 À RÈ, P-8 (EURO 6), TRANSMISSÃO AUTOMATIZADA, AR-CONDICIONADO)",0.0,600000.0,
68093,800,75772400000114,MUNICIPIO DE FLORIDA,INFRAESTRUTURA URBANA - CONSTRUÇÃO DE BARRACÃO INDUSTRIAL,0.0,500000.0,
21462,4085,45786159000111,MUNICIPIO DE IRACEMAPOLIS,INVSTIMENTO NA SEGURANÇA PÚBLICA DO MUNICÍPIO DE IRACEMÁPOLIS/SP.,0.0,100000.0,
72871,1346,83102483000162,MUNICIPIO DE MASSARANDUBA,EXECUÇÃO DO NOVO PADRÃO DE ENTRADA PARA AS INSTALAÇÕES ELÉTRICAS DA E.M.E.F. PROFª ARACI DUARTE,0.0,200000.0,
35190,6678,87297271000139,MUNICIPIO DE ARROIO DO MEIO,REPASSE PARA ASSOCIAÇÃO DE ÁGUA LINHA 32/CANUDOS (MELHORIAS NA REDE DE ABASTECIMENTO DE ÁGUA DA COMUNIDADE LOCAL),0.0,250000.0,
38829,774,10347466000111,MUNICIPIO DE FLORES,"PAVIMENTAÇÃO EM DIVERSAS RUAS NO MUNICIPIO DE FLORES / PE , CONSTRUÇÃO DE PRAÇAS E CONSTRUÇÃO DA REDE DE ESGOTO PUBLICO.


",0.0,3560000.0,
66037,1002,18298174000148,MUNICIPIO DE CORREGO DANTA,"CONSTRUÇÃO DE ESTAÇÃO DE TRATAMENTO DE ESGOTO e MANUTENÇÃO DE ILUMINAÇÃO PUBLICA COM LAMPADAS LED
",150000.0,300000.0,
74561,8799,83211391000110,MUNICIPIO DE SAO DOMINGOS DO ARAGUAIA,"AQUISIÇÃO DE MATERIAIS PARA FABRICAÇÃO DE  PRÉ MOLDADOS, PARA ATENDER AS NECESSIDADES DA SECRETARIA MUNICIPAL DE OBRAS DESSE MUNICÍPIO. ",0.0,500000.0,
18129,3820,72836588000129,MUNICIPIO DE VALPARAISO,Construção de galpão destinado a Incubadoras - Parte I - Administração e 4 box.,0.0,150000.0,
73217,6081,34887950000100,MUNICIPIO DE BRASIL NOVO,"- Sistema de Registro de Preços para futura e eventual recuperação, construção, complementação e piçarramento de vicinais e ramais que não estão contempladas em convênio no município de Brasil Novo.
Contrato Administrativo 063/2024 
Concorrência Pública SRP n° 001/2023 CP
- Revitalização da Pavimentação Asfáltica das vias: Rua do Comércio, Rua Duque de Caxias,e Av. Transamazônica localizadas na área Urbana do Município.
Contrato Nº 085/2024
CONCORRÊNCIA PÚBLICA Nº 007/2024-CP


",0.0,1985055.0,
37537,34074,46596235000199,MUNICIPIO DE SEVERINIA,Contratação de empresa para reforma da estação de tratamento de esgoto doméstico da bacia do Pua D' Alho no municipio de Severinia/SP.,0.0,1500000.0,
69666,3369,01613204000160,MUNICIPIO DE PINGO D'AGUA,obras e instalações.,0.0,500000.0,
33316,19487,45660594000103,MUNICIPIO DE AURIFLAMA,Execução de obra de recapeamento asfáltico.,0.0,400000.0,
16606,7074,56024581000156,MUNICIPIO DE RIBEIRAO PRETO,"Projeto educando para a vida, cuidando do planeta.",0.0,120000.0,
71014,2980,04477600000104,MUNICIPIO DE NOVA OLINDA DO NORTE,Ampliação da Mini Vila Olimpica ,0.0,1421585.0,
20988,26293,02385839000110,MUNICIPIO DE ORIZONA,"Objeto: pavimentação asfáltica do Bairro Bela Vista.

Detalhamento: Foram executados 3.201,34 m² de pavimentação asfáltica em TSD (Tratamento Superficial Duplo), 979,62 metros de sarjeta e 979,62 metros de meio fios em concreto
",0.0,300000.0,
20001,25158,18301010000122,MUNICIPIO DE DORES DO INDAIA,"EXECUÇÃO DE OBRA REFERENTE À CONSTRUÇÃO DA ""PRAÇA NO BAIRRO RESIDENCIAL SANTA CRUZ”",0.0,50000.0,
73509,3859,82928698000174,MUNICIPIO DE JAGUARUNA," Pavimentação da Rua José Joaquim Ferreira, 204m",0.0,500000.0,
18481,5327,37623485000180,MUNICIPIO DE SANTO ANTONIO DE GOIAS,Pavimentação de Vias Publicas,0.0,250000.0,
21411,31240,10657240000117,FUNDO MUNICIPAL DE SAUDE - FUNSAUDE,"AQUISIÇÃO DE VEÍCULO AUTOMOTOR TIPO AMBULÂNCIA FIAT/FIOR FLEX 2023/2024, PARA ATENDER A MANUTENÇÃO DOS SERVIÇOS TECNICOS E ADMINISTRATIVOS DO F.M.SAÚDE.",0.0,525000.0,
12143,3476,04190765000192,MUNICIPIO DE EIRUNEPE,Aquisição de Kits de Energia Solar para as Comunidades Rurais.,0.0,1000000.0,
65841,2109,01612686000134,MUNICIPIO DE CACIMBAS,"Investimentos no município. 
MANUTENÇAO DAS ATIV DA SEC DE OBRAS URBANISMO E SANEAMENTO ( SERVIÇOS TERCEIROS PESSOA JURIDICA",1000000.0,1000000.0,
70612,3773,91553966000101,MUNICIPIO DE DEZESSEIS DE NOVEMBRO,Com a presente proposta será executada obras de infraestrutura urbana com a implantação de Passeio público na Avenida Independência.,0.0,100000.0,
36942,11830,91693283000150,MUNICIPIO DE HARMONIA,capeamento,0.0,100000.0,
64775,32043,00766733000131,MUNICIPIO DE SAO SEBASTIAO DO TOCANTINS,"CUSTEIO, PAGAMENTO DE DESPESAS DIVERSAS.",1000000.0,0.0,
11043,6189,31723570000133,MUNICIPIO DE VARGEM ALTA,Manutenção de instalações públicas,0.0,260000.0,
38976,33395,06554133000196,MUNICIPIO DE MARCOS PARENTE,Construção PIsta Cooper,0.0,282400.0,
14197,27793,46947396000180,MUNICIPIO DE INDIAPORA,iluminação p´´ublica,0.0,250000.0,
30995,29004,19229921000159,MUNICIPIO DE CAPELINHA,CONSTRUÇÃO DE QUADRA POLIESPORTIVA,0.0,250000.0,
72337,1339,93235943000184,MUNICIPIO DE MARATA,Melhorias Sociedade Esperança,0.0,120000.0,
21855,1349,83169623000110,MUNICIPIO DE JOINVILLE,Obra de infraestrutura urbana,0.0,250000.0,
72162,388,77817476000144,MUNICIPIO DE DIAMANTE D'OESTE,um centro comunitário e duas mini quadras esportivas,0.0,450000.0,
72762,406,83102459000123,MUNICIPIO DE JARAGUA DO SUL,"Aquisição de quadra poliesportiva em madeira no sistema portátil flexível flutuante com amortecimento na Arena Jaraguá localizada na Rua Gustavo Hagedorn nº 636 – Nova Brasília – Jaraguá do Sul /SC,",0.0,1000000.0,
19468,20413,88000906000157,MUNICIPIO DE ALVORADA,"Complemento de recurso para a pavimentação das vias José do Patrocínio, Leonardo Ribeiro e Lajeado, situadas dentro do perímetro urbano do Município de Alvorada/RS",0.0,250000.0,
18268,484,87612941000164,MUNICIPIO DE IRAI,Pavimentação Asfáltica CBUQ nas Ruas Henry Giessembier e Rua Avelino Dazzi,0.0,200000.0,
4585,27812,22646525000131,MUNICIPIO DE MONTE SIAO,PAVIMENTAÇÃO DE VIAS URBANAS - PAVIMENTAÇÃO ASFALTICA EM CBUQ E DRENAGEM NO BAIRRO LOTEAMENTO VALE DO SOL,0.0,750000.0,
67609,4447,13646005000138,MUNICIPIO DE ALAGOINHAS,PAVIMENTAÇÃO E DRENAGEM DE VIAS NA SEDE DO MUNICÍPIO DE ALAGOINHAS,0.0,3000000.0,
18218,1494,82575812000120,MUNICIPIO DE PORTO BELO,"Aquisição de Retroescavadeira Tipo A, para atender as demandas da Secretaria Municipal de Agricultura de Porto Belo/SC.",0.0,250000.0,
68670,23357,83102327000100,MUNICIPIO DE PENHA,Drenagem e Pavimentação Servidão Antônio João Romão,0.0,162500.0,
34085,2558,03342938000188,MUNICIPIO DE INOCENCIA,Execução de obra de construção de praça no Município de Inocência ,0.0,400000.0,
18396,2556,97320030000117,MUNICIPIO DE SARANDI,Aquisição de van para transporte de pacientes,0.0,180000.0,
70951,2724,14199921000130,MUNICIPIO DE SANTA INES,"EXECUÇAO DE OBRAS/SERVIÇOS DE PAVIMENTAÇAO EM PARALELEPLPEDO NOS POVOADOS LAGOA QUEIMADA, IMBE E NATUR DE ASSIS, NA ZONA RURAL DO MUNICIPIO DE SANTA INES/BA.",0.0,1000000.0,
21015,899,30417158000122,MUNICIPIO DE ITALVA,"Construção de ponte no Valão da Prata estrada Guarnieri X Biboca (Parcial)
Urbanização Rua Adelcio Canuto",0.0,200000.0,
65926,3458,13883996000172,MUNICIPIO DE CORACAO DE MARIA,PAVIMENTAÇÃO ASFALTICA EM ZONA URBANA DO MUNICIPIO DE CORAÇÃO DE MARIA,0.0,500000.0,
18652,12877,02070563000181,MUNICIPIO DE DOIS IRMAOS DO TOCANTINS,CONSTRUIR E AMPLIAR PRÉDIOS PÚBLICOS (ampliação do ginásio municipal),0.0,400000.0,
68291,2683,06554455000135,MUNICIPIO DE BURITI DOS LOPES,Investimento qualidade de vida população de Buriti dos Lopes/PI,1435737.0,0.0,
20867,34212,06553812000140,MUNICIPIO DE PIO IX,"AQUISIÇÃO DE PNEUS, PARA MANUTENÇÃO DE VEÍCULOS, SOB A RESPONSÁBILIDADE DESSE ÒRGÃO.

META 1:

2 Pneus 275/80R22.5 direcional

2 Pneus 275/80R22.5 tração
",0.0,13508.76,
16324,2755,95952248000169,MUNICIPIO DE MIRIM DOCE,AQUISIÇÃO DE LAJE TIPO PI (NÃO INCLUSO GUARDA RODAS) PRÉ-MOLDADAS EM CONCRETO ARMADO FCK-35 NO TAMANHO DE 125X400CM,0.0,200000.0,
71525,812,75798355000177,MUNICIPIO DE INDIANOPOLIS,PAVIMENTAÇÃO E RECAPEAMENTO DE RUAS E AVENIDAS,0.0,500000.0,
35819,1344,27174101000135,MUNICIPIO DE ALEGRE,"Cobertura da Arena do Parque de Exposições Geraldo Santos, localizado na sede do Município de Alegre, que atende a população em geral, mas principalmente os produtores rurais do Município, com a realização da Expoagro e demais eventos agropecuários.",0.0,5000000.0,
34691,25316,17734906000132,MUNICIPIO DE PALMA,AQUISIÇÃO DE VEÍCULOS.,0.0,500000.0,
66916,814,63762041000135,MUNICIPIO DE CORUMBIARA,PONTE DEFINITIVA EM AÇO ESTRUTURAL E CONCRETO ARMADO,0.0,1800000.0,
15677,32048,14199921000130,MUNICIPIO DE SANTA INES,Contratação de empresa de engenharia para execução de obras/serviços da construção e estruturação do espaço que irá acolher os Núcleos e Centro Especializado Educacional de Educacional de Santa Inês – BA,0.0,300000.0,
74355,10952,10348050000118,MUNICIPIO DE SOLIDAO,CONSTRUÇÃO/INSTALAÇÃO DE ESTAÇÕES DE TRATAMENTO DE ESGOTO.,0.0,1000000.0,
13254,811,63762041000135,MUNICIPIO DE CORUMBIARA,AQUISIÇÃO DE TUBOS ARMCO E CONSTRUÇÃO DE PONTE DE CONCRETO E AÇO,0.0,250000.0,
73089,3775,17111626000178,MUNICIPIO DE JOANESIA,"Pavimentação de estrada vicinal conhecido como morro da Serrinha, acesso a comunidade do Braço

",0.0,200000.0,
9954,21150,82558909000124,MUNICIPIO DE LAURO MULLER,"Aquisição de Retroescavadeira Traçada e cabinada, livre e desimpedido de qualquer ônus.",0.0,300000.0,
33875,23936,01626099000102,MUNICIPIO DE MANARI,PROMOÇÃO E DESENVOLVIMENTO DA AGRICULTURA MUNICIPAL.,0.0,200000.0,
68298,836,75461970000193,MUNICIPIO DE PORTO RICO,INFRAESTRUTURA URBANA E TURÍSTICA,0.0,2000000.0,
36808,7567,44435121000131,MUNICIPIO DE BURITAMA,Cobertura de quadra da academia da saude,0.0,100000.0,
11770,5825,02218683000183,MUNICIPIO DE ACREUNA,"RECAPEAMENTO CBUQ, NA RUA LÁZARO DO CARMO ARANTES - ÁREA DO PERIMETRO URBANO DE ACREÚNA-GO,",0.0,670000.0,
19830,21146,04477642000137,MUNICIPIO DE AUTAZES,"AQUISIÇÃO DE ITENS DE MOBÍLIA DIVERSOS
 AQUISIÇÃO DE ITENS DE MOBÍLIA DIVERSOS
AQUISIÇÃO DE 01(UMA) EMBARCAÇÃO TIPO ARCA ",0.0,1000000.0,
12919,2674,18307397000124,MUNICIPIO DE COLUNA,"Obra de Construção da cobertura de quadra de esporte, situada na praça Joaquim Marques, no bairro Varzea, na cidade de Coluna/MG.",0.0,200000.0,
18191,22074,95640553000115,MUNICIPIO DE IVATE,Ações de Infraestrutura Urbana ,0.0,100000.0,
71277,824,65708786000141,MUNICIPIO DE UBARANA,INFRAESTRUTURA URBANA,0.0,300000.0,
31892,28111,06314827000156,MUNICIPIO DE GONCALVES DIAS,Contratação de empresa especializada para a execução de serviços de construção do centro administrativo Municipal,0.0,1000000.0,
37854,17107,01740588000182,MUNICIPIO DE GUARANI DE GOIAS,"AQUISIÇÃO DE 01 VEÍCULO UTILITÁRIO TIPO MINIVAN PARA APOIO ÀS AÇÕES DA PREFEITURA MUNICIPAL DE GUARANI DE GOIÁS NO ÂMBITO DO SUS
",0.0,100000.0,
19354,20786,52381720000148,MUNICIPIO DE COLOMBIA,Recapeamento da avenida dos portos localizada na área urbana do município de Colômbia,0.0,100000.0,
41963,3327,04223461000184,MUNICIPIO DE GAMELEIRA DE GOIAS,Implantação do Programa de Eficiência Energética.,0.0,900000.0,
35942,28555,06769798000117,MUNICIPIO DE BARRA DO CORDA,PAVIMENTAÇÃO NAS VIAS DA ZONA RURAL E SEDE DO MUNICÍPIO DE BARRA DO CORDA/MA,0.0,1000000.0,
36556,23206,08162687000173,MUNICIPIO DE GOIANINHA,"Construção e reforma de Passagem Molhada no distrito de Jundiá, zona rural do município de Goianinha-RN",0.0,400000.0,
21329,19859,11884903000107,FUNDO MUNICIPAL DE SAUDE DE SAO GONCALO,Construção USF,0.0,350000.0,
65910,16090,49345911000140,MUNICIPIO DE IEPE,"A presente proposta visa a utilização de recursos de emenda de custeio para o fortalecimento das ações desenvolvidas no Serviço de Convivência e Fortalecimento de Vínculos (SCFV), destinado a crianças e adolescentes de 06 a 14 anos. Os recursos serão aplicados na contratação de oficinas especializadas e na aquisição de materiais pedagógicos, lúdicos e artísticos, com o intuito de promover o desenvolvimento integral, a convivência comunitária e o fortalecimento dos vínculos familiares e sociais.

Objetivo:
Utilizar recursos de emenda parlamentar de custeio para fortalecer e ampliar as ações do Serviço de Convivência e Fortalecimento de Vínculos (SCFV) voltado a crianças e adolescentes de 06 a 14 anos. Os recursos serão empregados na contratação de oficinas socioeducativas e culturais, bem como na aquisição de materiais de consumo, pedagógicos e lúdicos, fundamentais para a realização das atividades.

1. Contratação de Oficinas Especializadas
Serão contratados profissionais para condução de oficinas periódicas com foco no desenvolvimento social, cognitivo, emocional e cultural das crianças e adolescentes atendidos.

Oficinas previstas:

Música (violão, percussão, canto)
Dança (dança popular, contemporânea, hip hop)
Teatro e expressão corporal
Artesanato e reciclagem
Capoeira e esportes recreativos
Contação de histórias e incentivo à leitura
Educação ambiental

2. Materiais de Consumo
Os materiais de consumo serão utilizados no dia a dia das atividades do SCFV, garantindo suporte adequado para oficinas e dinâmicas que compõem a rotina pedagógica e recreativa dos participantes.

Lista de Materiais de Consumo:

Materiais de papelaria:
Papel sulfite A4 (resmas)
Cartolina colorida
Papel color set e papel kraft
Lápis preto e lápis de cor
Canetas, canetinhas coloridas
Borracha, apontador
Tesouras escolares
Cola branca e cola bastão
Réguas e esquadros
Cadernos e blocos de anotação
Materiais artísticos:
Tintas guache e tinta acrílica
Pincéis de diversos tamanhos
Argila, massa de modelar
EVA, papel crepom e TNT
Tecidos diversos para artesanato
Lantejoulas, botões, miçangas, fitas decorativas
Materiais lúdicos e pedagógicos:
Jogos educativos (memória, dominó, quebra-cabeça)
Brinquedos pedagógicos (blocos de montar, fantoches)
Livros infantis e infantojuvenis
Revistas de atividades educativas
Materiais para atividades físicas e recreativas:
Bolas (futebol, vôlei, queimada)
Bambolês, cordas, cones e estacas
Petecas, saquinhos de areia para equilíbrio
Tapetes emborrachados
Materiais de apoio e organização:
Caixas organizadoras plásticas
Pastas, envelopes e fichários
Estantes ou prateleiras para armazenamento
Sacolas ou mochilas para kits individuais
Copos, pratos e talheres descartáveis (uso eventual em eventos ou lanches)

Justificativa:
O investimento em materiais de consumo e na contratação de oficinas especializadas proporcionará uma melhoria significativa na qualidade das ações desenvolvidas no SCFV. Esses recursos são essenciais para a realização de atividades planejadas, estimulando a criatividade, a socialização, o protagonismo e o fortalecimento dos vínculos familiares e comunitários. A aquisição está em conformidade com as diretrizes do Sistema Único de Assistência Social (SUAS), garantindo a continuidade e o aprimoramento do atendimento ofertado.",100000.0,0.0,
68087,813,75798355000177,MUNICIPIO DE INDIANOPOLIS,"Reforma e Ampliação do Ginásio de Esportes do Município de Indianópolis-PR, com área existente de 1.356,36 m² a ser reformada e uma área de 56,74 m² a ser construída, totalizando 1.413,10 m², visando a melhoria das condições estruturais, funcionais e de acessibilidade do espaço, proporcionando mais segurança, conforto e qualidade para a prática esportiva e realização de eventos.",559791.0,120000.0,
34154,21147,82558149000155,MUNICIPIO DE GRAO PARA,"AQUISIÇÃO DE LAJOTAS SEXTAVADAS DE CONCRETO, PARA PAVIMENTAÇÃO",0.0,300000.0,
16275,8894,01830793000139,MUNICIPIO DE ARAGUAINA,"Aquisição de veículo de carga e veículo administrativo para a Secretaria da Infraestrutura, no município de Araguaína/TO e Aquisição de Peças para TI",300000.0,169682.0,
67976,3571,08790172000118,MUNICIPIO DE SERRARIA,CUSTEIO ASSISTENCIA SOCIAL E MELHORIAS DO SERVIÇO DE CONVIVENCIA E FORTALECIMENTO DE VINCULOS,60000.0,140000.0,
20869,33797,06554067000154,MUNICIPIO DE FLORIANO,"Recuperação e Implantação de Rotatórias em Vias publicas do Municipio de Floriano - PI
PAVIMENTAÇÃO EM PARALELEPIPEDO EM DIVERSAS RUAS",0.0,400000.0,
66875,861,01620744000171,MUNICIPIO DE VERMELHO NOVO,Instalação de usina de energia elétrica fotovoltaica - Pavimentação de estradas vicinais.,0.0,350000.0,
15330,32474,23098510000149,MUNICIPIO DE ARAPORA,Aquisição de veículo para atender Vigilância Epidemiológica e Aquisição de tecidos aviamentos e materiais para artesanato para atender as unidades escolares em seus projetos com os alunos,150000.0,0.0,
14181,853,63762041000135,MUNICIPIO DE CORUMBIARA,CONSTRUÇÃO DE BOSQUE DISTRITO DE VITORIA DA UNIÃO E AQUISIÇÃO DE MATERIAIS ESPORTIVOS,50000.0,350000.0,
74476,475,83026138000197,MUNICIPIO DE DESCANSO,"EXECUÇÃO DE OBRA DE MELHORIAS NA CEI - CRECHE JUDITE ANGELA BALBINOT PRIGOL NO DISTRITO DE ITAJUBÁ E INSTALAÇÃO DE ENTRADA DE ENERGIA ELETRICA EM MEDIA TENSÃO, JUNTO A CRECHE PRÉ-ESCOLA TIPO 1 – FNDE, NO MUNICÍPIO DE DESCANSO/SC.",0.0,200000.0,
41755,854,63762041000135,MUNICIPIO DE CORUMBIARA,"PROLONGAMENTO DE ILUMINAÇÃO AV. ITÁLIA FRANCO, SUBSTITUIÇÃO DE BRAÇOS E LUMINÁRIAS DE LED NO MUNICÍPIO DE CORUMBIARA/RO E DISTRITOS (RONDOLANDIA, VITORIA DA UNIÃO E ALTO GUARAJUS)",0.0,300000.0,
36911,17607,01611339000197,MUNICIPIO DE BALNEARIO PINHAL,"Aquisição de playgrounds, construção de bancos e floreiras e pagamento parcial de obra de pavimentação e drenagem da Avenida Atlântico.",0.0,250000.0,
66282,8801,13718176000125,MUNICIPIO DE BOA VISTA DO TUPIM,"R$110.000,00
Execução de projeto da ponte que liga o assentamento Canabrava, situado no município de Boa Vista do Tupim ao assentamento Queimadinhas, município de Marcionilio Souza.

R$640.000,00
Pavimentação em paralelepípedo em diversas ruas na sede e zonas rurais do município de Boa Vista do Tupim.",750000.0,0.0,
21190,2731,37420916000100,MUNICIPIO DE LAGOA DO TOCANTINS,Infrestrutura.,0.0,150000.0,
67039,1437,82777343000121,MUNICIPIO DE BOM RETIRO,Aquisição de Caminhão e Assistência ao Idoso através do Chamamento Publico a Repasse a Entidade sem Fins Lucrativos,0.0,400000.0,
21767,862,63762041000135,MUNICIPIO DE CORUMBIARA,AQUISIÇÃO DE VEICULOS,0.0,200000.0,
15527,860,63762041000135,MUNICIPIO DE CORUMBIARA,CONSTRUÇÃO DE GALERIA,0.0,500000.0,
20685,863,63762041000135,MUNICIPIO DE CORUMBIARA,AQUISIÇÃO DE VEICULO MICRO ONIBUS,0.0,300000.0,
33900,23923,01626099000102,MUNICIPIO DE MANARI,CONSTRUÇÃO E RECUPERAÇÃO DE ESTRADAS VICINAIS NO MUNICÍPIO,0.0,300000.0,
37478,5195,21498274000122,MUNICIPIO DE CLARO DOS POCOES,CONSTRUÇÃO DE PRAÇA PÚBLICA ,0.0,300000.0,
