id_plano_acao,id_executor,cnpj_executor,nome_executor,objeto_executor,vl_custeio_executor,vl_investimento_executor,uf_beneficiario_plano_acao
38527,33566,01613028000167,MUNICIPIO DE IRACEMA,RECUPERAÇÃO DE ESTRADAS VICINAIS ,0.0,4350000.0,
71311,3339,08787012000110,MUNICIPIO DE DUAS ESTRADAS,"Reconstrução do Palacete Francisco Costa
",0.0,300000.0,
66198,294,16429268000183,MUNICIPIO DE SAO JOSE DA VITORIA,"Construção do CRAS – Centro de Referência da Assistência Social, através de Emenda Parlamentar nº 202437380005, do Município de São José da 
Vitória/Bahia, suficientemente especificada nos projetos, memoriais e especificações técnicas, detalhes, catálogo de componentes e planilha orçamentária.",0.0,300000.0,
74780,9445,01629276000104,MUNICIPIO DE NOVO GAMA,Infraestrutura no municipio de Novo Gama - GO. ,0.0,2000000.0,
41779,5730,88186754000129,MUNICIPIO DE PUTINGA," AQUISIÇÃO DE MATERIAIS DE CONSTRUÇÃO PARA AMPLIAÇÃO DO GINÁSIO DA
 LINHA PUTINGA BAIXA, NO INTERIOR DO MUNICÍPIO DE PUTINGA, COM RECURSOS DO PROGRAMA/PLANO DE
 AÇÃO Nº 09032023-2-041779 DO DEPUTADO FEDERAL AFONSO HAMM",0.0,200000.0,
16328,295,83102780000108,MUNICIPIO DE BENEDITO NOVO,Manutenção das Vias urbanas,0.0,200000.0,
4113,18162,76167733000187,MUNICIPIO DE SAPOPEMA,CONSTRUÇÃO DE REDE DE ABASTECIMENTO DO BAIRRO MAMBUCAS,0.0,300000.0,PR
20124,30850,07725138000105,MUNICIPIO DE SANTA QUITERIA,"AQUISÇÃO DE VEÍCULOS E EQUIPAMENTOS
",0.0,1300000.0,
3459,299,83102780000108,MUNICIPIO DE BENEDITO NOVO,Abertura e Pavimentação de Ruas,0.0,250000.0,SC
3367,359,46392122000171,SECRETARIA MUNICIPAL  DE ESPORTES E LAZER _  SEME,"Contratação de empresa para aquisição equipamentos esportivos para prática de Ginástica Artística desenvolvida no COTP, do Departamento de Gestão de Alto Rendimento – DGEA.",0.0,850000.0,SP
14117,300,83102780000108,MUNICIPIO DE BENEDITO NOVO,Manutenção das Atividades da Saúde,180000.0,0.0,
16593,3230,44428506000171,MUNICIPIO DE ANDRADINA,INFRAESTRUTURA - DRENAGEM DE AGUAS PLUVIAIS,0.0,100000.0,
14480,3238,01067933000169,MUNICIPIO DE NOVO ACORDO,Infraestrutura,0.0,200000.0,
31302,29997,01612539000164,MUNICIPIO DE ARAGUANA,MANUTENÇÃO DOS DIVERSOS SERVIÇOS NECESSARIOS PARA O BOM FUNCIONAMENTO DA ADMISTRAÇÃO MUNICIPAL DE ARAGUANÃ - MA.,950000.0,0.0,
74835,10753,06323208000128,MUNICIPIO DE IGARAPE GRANDE,Recursos destinados da emenda 202444190004-Márcio Honaiser,0.0,1000000.0,
70431,495,01613194000163,MUNICIPIO DE ANAPU,"REFORMA E AMPLIAÇÃO DA FEIRA MUNICIPAL DE ANAPU, E CONSTRUÇÃO DE 02 VESTIARIOS NO ESTADIO MUNICIPAL DE ANAPU",0.0,1150000.0,
35572,32040,87482535000124,MUNICIPIO DE DOM PEDRITO,aquisição de equipamentos ,0.0,200000.0,
10846,8789,95548400000142,MUNICIPIO DE MAUA DA SERRA,"Aquisição de Móveis, equipamentos e eletrodomésticos para equipar a Casa Lar.",0.0,100000.0,
31341,10114,12200150000128,MUNICIPIO DE PILAR,"15.451.0008.1002 - PAVIMENTAÇÃO ASFÁLTICA OU EM PARALELEPIPEDO
3.4.4.9.0.51 - OBRAS E INSTALAÇÕES",0.0,400000.0,
71479,3688,76167725000130,MUNICIPIO DE CURIUVA,INFRA ESTRUTURA URBANA - PAVIMENTAÇÃO EM CBUQ EM VIAS URBANAS E REVITALIZAÇÃO DO ESTADIO MUNICIPAL,0.0,500000.0,
11656,2395,04034583002176,MUNICIPIO DE RIO BRANCO,Construção da 1ª etapa da Câmara Municipal de Rio Branco,0.0,500000.0,
13687,27319,18404897000184,MUNICIPIO DE BERTOPOLIS,"Pavimentação asfaltica de vias públicas urbanas em PMF - pre-misturado a frio na sede do Municipio de Bertópolis.

Obs. Foi mensurado em metros cúbicos a Unidade, no sistema não existe KM isoladamente.",0.0,150000.0,
72259,21974,14147938000143,MUNICIPIO DE ITAPE,“SUBSTITUIÇÃO E AMPLIAÇÃO DA COBERTURA DA RODOVÍARIA DO MUNICÍPIO DE ITAPÉ – BAHIA”,0.0,300000.0,
73744,15147,17857442000151,MUNICIPIO DE SANTA RITA DE CALDAS,AQUISIÇÃO DE RETROESCAVADEIRA,0.0,500000.0,
74154,287,08153462000150,MUNICIPIO DE MARTINS,Pavimentação de ruas,0.0,300000.0,
15141,20397,88000906000157,MUNICIPIO DE ALVORADA,"Pavimentação da Rua José do Patrocínio e Travessa Leonardo Ribeiro, situadas dentro do perímetro urbano do Município de Alvorada/RS",0.0,300000.0,
33002,28502,05105283000150,MUNICIPIO DE CAMETA,aquisição de bombas para manutenção de sistemas de água e construção de microssistema de trantamento de água,0.0,1488333.0,
38630,33567,01613028000167,MUNICIPIO DE IRACEMA,RECUPERAÇÃO DE ESTRADAS VICINAIS ,0.0,5500000.0,
38635,33568,01613028000167,MUNICIPIO DE IRACEMA,RECUPERAÇÃO DE ESTRADAS VICINAIS ,0.0,2000000.0,
71243,33739,18132449000179,MUNICIPIO DE VICOSA,obras de infraestrutura no Município de viçosa,0.0,500000.0,
69421,752,01067255000134,MUNICIPIO DE ITAGUARU,"Custeio - meio ambiente
",50000.0,0.0,
74433,596,95990107000130,MUNICIPIO DE SUL BRASIL,REFORMA DE GINÁSIO DE ESPORTES DA COMUNIDADE D E LINHA ALTO RECREIO,0.0,150000.0,
66217,301,44733608000109,MUNICIPIO DE INDAIATUBA,Aquisição de mobiliários e equipamentos em geral visando equipar o CREAS e Centro PCD.,0.0,500000.0,
72845,113,83102293000145,MUNICIPIO DE CAMBORIU,"1. Identificação do Projeto
Nome do Projeto: Aquisição de Veículos Tipo Van para o Fundo Municipal de Saúde 
Ente Federado Beneficiado: Camboriú/SC
CNPJ do Ente Federado: 83.102.293/0001-45
Data de Recebimento dos Recursos: 04/07/2024

2. Descrição do Objeto
Objeto a ser Executado: Aquisição de Veículos Tipo Van para o Fundo Municipal de Saúde
Metas a serem Alcançadas: O município de Camboriú/SC está localizado na região litorânea do estado do Santa Catarina, às margens da BR-101, com uma população de 87.179 habitantes, população que em grande parte utiliza o Sistema único de Saúde em razão da situação sócio-ecônomica de grande parte da população. O município de Camboriú/SC possui uma demanda diária mínima de 143 pessoas, sem a inclusão dos acompanhantes, que necessitam de tratamento fora de domicílio - TFD com doenças crônicas. Os municípios de referência são: Itajaí, 20 km de distância e Florianópolis a, 92 km de distância. O público-alvo a ser beneficiado com o transporte sanitário eletivo são: pessoas que tiverem consulta/exame marcado, que necessitem de procedimento eletivo em serviços ofertados pelo sistema único de saúde por meio do processo regulatório estabelecido no âmbito municipal e pacientes que necessitem de tratamento fora de domicílio TFD. Os parâmetros aplicados para dimensionar e gerenciar a programação de transporte e necessidade do transporte sanitário eletivo são: necessidades de exame ou tratamento fora de domicílio por dia da semana, ou seja, de acordo com a data do exame ou do TFD do paciente, as duas vans realizarão o transporte ao município de referência. A aquisição de duas vans irá promover o acesso a exames de média e alta complexidade nos municípios de referência, tendo em vista que estes não são realizados no município. Essa aquisição irá trazer enormes benefícios à população de Camboriú, bem como visa o princípio da economicidade, visto que atualmente tal transporte é realizado por veículos antigos, que demandam alta valor de manutenção, e/ou veículos de pequeno porte, que necessitam de várias viagens a fim de concluir a demanda diária dos pacientes atendidos;

3. Estimativa Financeira
Valor Total dos Recursos: R$ 692.00,00 (seiscentos e noventa e dois mil reais);
Valor das Transferências Especiais: R$ 600.000,00 (seiscentos mil reais), oriundo de Fonte de Recurso Federal;
Outras Fontes de Recursos: R$ 92.000,00 (noventa e dois mil reais), de Fonte de Recursos Própria;
Classificação Orçamentária: Investimento em Estrutura Física de Bens Móveis
Despesa Corrente: R$ 0,00 (zero reais)
Despesa de Capital: R$ 692.000,00 (seiscentos e noventa e dois mil reais);
Fonte ou Destinação dos Recursos: Fonte de Recursos Federais e Próprias do Município de Camboriú, com destinação ao patrimônio próprio do Executivo do Município de Camboriú.

4. Cronograma de Execução
Data de Início: 04 de Julho de 2024
Previsão de Conclusão: Março de 2025
Prazos de Execução: Entrega do Veículo, Previsão 19 de dezembro de 2024; Emplacamento 31 de janeiro de 2024, plotagem e seguro do veículo, 01 de Março de 2024.

5. Execução Orçamentária e Financeira
Documentação das Despesas:
Contratos Celebrados: substituído por Ata de Registro de Preço (em anexo);
Notas de Empenho: 2095 e 2096/2024 em anexo;
Notas Fiscais e Recibos: Aguardando Fornecimento;
Ordens Bancárias e Extratos de Conta Corrente: Em anexo;
Termos de Recebimento de Obras, Fornecimento e Serviços: Não se aplica
Detalhamento da Execução:
Montante Utilizado: R$ 692.000,00 (seiscentos e noventa e dois mil reais);
Saldo Disponível: Aguardando Fornecimento;

6. Verificação do Cumprimento das Condicionantes Constitucionais
Inciso I e II do §1º do art. 166-A: Os recursos não foram aplicados em despesas com pessoal e encargos sociais relativas a ativos e inativos, e com pensionistas; e encargos referentes ao serviço da dívida: não se aplica;

Inciso III do §2º do art. 166-A: Os recursos foram aplicados em programações finalísticas das áreas de competência do Poder Executivo: Sim;

7. Transparência e Controle Social
Notificação ao Conselho Local ou Instância de Controle Social:
Data de Notificação: 31 de julho de 2024
E-mail Institucional Notificado: através de ofício (anexo)

8. Gestão e Fiscalização
Relatório de Gestão: em andamento;
Acompanhamento pela Controle Interno: análise positiva que resultou na Nota de Empenho;
Processos de Apuração: não se aplica;
Prorrogações de Prazos: não se aplica;

9. Considerações Finais
Declaro que todas as atividades foram conduzidas conforme as normas estabelecidas e que todas as informações fornecidas são verdadeiras e completas, conforme as disposições do art. 166-A da Constituição Federal.",0.0,600000.0,
15742,28511,18404764000108,MUNICIPIO DE PADRE PARAISO,"Cobertura em área da Creche Alertas.
Pavimentação da estrada de Duas Barras",0.0,200000.0,
33362,350,18307389000188,MUNICIPIO DE BRAUNAS,O executor é o beneficiário,0.0,300000.0,
70697,8478,87613386000195,MUNICIPIO DE MARIANO MORO,Investimento em recuperação de pavimentação de Estrada Rural,0.0,150000.0,
74884,17235,91987719000113,MUNICIPIO DE SANTA TEREZA,"Pavimentação de estradas vicinais, a pavimentação em questão irá beneficiar todos os moradores/agricultores que ali residem ",0.0,1000000.0,
34553,29018,19229921000159,MUNICIPIO DE CAPELINHA,EXECUÇÃO DE OBRA DE ADEQUADAÇÃO E FINALIZAÇÃO DE PREDIO MUNICIPAL,0.0,200000.0,
68019,9711,82926544000143,MUNICIPIO DE ORLEANS,AQUISIÇÃO DE INSUMOS PARA PAVIMENTAÇÃO DE VIAS,200000.0,0.0,
74398,16620,04076733000160,MUNICIPIO DE PLACIDO DE CASTRO,Melhoramento de vias urbanas com pavimentação no município de Plácido de Castro,0.0,800000.0,
13265,34147,29076130000190,MUNICIPIO DE VALENCA,Construção do Pórtico de entrada de Valença/RJ.,0.0,350000.0,
14715,28139,06314827000156,MUNICIPIO DE GONCALVES DIAS,AQUISIÇÃO DE MOVEIS PARA O CENTRO ADIMISTRATIVO MUNICIPAL,0.0,200000.0,
13506,30003,46634069000178,MUNICIPIO DE ARACOIABA DA SERRA,"Construção de praça de cultura e eventos, atrelado a AÇÃO: IMPLANTAÇÃO, INSTALAÇÃO E MODERNIZAÇÃO DE ESPAÇOS E EQUIPAMENTOS
CULTURAIS.",0.0,500000.0,
75147,5191,87876801000101,MUNICIPIO DE TORRES,Pavimentação de via pública,0.0,100000.0,
69070,2427,83102244000102,MUNICIPIO DE GASPAR,Aquisição de livros didáticos e paradidáticos de história e cultura afro-brasileira  - AFROLETRAMENTO,300000.0,0.0,
68624,1369,08764284000102,MUNICIPIO DE SANTA HELENA,Pavimentação Urbana. ,0.0,800000.0,
19913,28834,34671016000148,MUNICIPIO DE PAU D'ARCO,Implantação dos Sistemas de Iluminação Publica em Led das Ruas e Avenidas do Município de Pau D'arco.,0.0,300000.0,
36670,16463,01612443000104,MUNICIPIO DE BOM JESUS DO SUL,Obras e Instalações,0.0,250000.0,
68819,624,83102657000197,MUNICIPIO DE LAURENTINO,Pavimentação da Rua Prefeito Armelindo Rosa (Trecho 2),0.0,250000.0,
35759,31824,76217017000167,MUNICIPIO DE BOA ESPERANCA,AQUISIÇÃO DE VEÍCULO ZERO KM PARA SECRETARIA MUNICIPAL DE EDUCAÇÃO,0.0,100000.0,
74881,310,94704004000102,MUNICIPIO DE BARRA FUNDA,"Execução de pavimentação asfáltica em trecho da Linha Santa Lúcia no interior do Município e de uma pista de caminhada em trecho da Rua Santa Lúcia, localizada no Bairro Navegantes, na área urbana do Município.",0.0,200000.0,
71990,478,87849923000109,MUNICIPIO DE BENTO GONCALVES,"Pavimentação da Rua Armindo Germano Franzoni, área urbana do município de Bento Gonçalves. ",0.0,100000.0,
42239,33569,01613028000167,MUNICIPIO DE IRACEMA,RECUPERAÇÃO DE ESTRADAS VICINAIS ,0.0,1999700.0,
11642,28992,12247946000136,MUNICIPIO DE JAPARATINGA,Infraestrutura ,0.0,705000.0,
9411,307,17112061000143,MUNICIPIO DE MESQUITA,O executor é o beneficiário ,0.0,150000.0,
36993,2642,83102459000123,MUNICIPIO DE JARAGUA DO SUL,"Serviços de engenharia, com fornecimento de materiais e mão de obra, para Reforma da arquibancada, Construção de Cobertura da Arquibancada; Sanitários Públicos e Lanchonete da Pista de Atletismo, localizada na Rua 209 Francisco Hruschka, 1111, no Bairro São Luís, no município de Jaraguá do Sul/SC",0.0,1351701.0,
15793,28003,20905865000104,MUNICIPIO DE INHAPIM,Construção da Praça Pedro Everaldo Rosa - Distrito do Novo Horizonte,0.0,150000.0,
35854,28503,05105283000150,MUNICIPIO DE CAMETA,Manutenção preventiva de vias urbanas,0.0,500000.0,
34384,322,82892266000150,MUNICIPIO DE AGUAS MORNAS,"Contrução de calçadas de 0,74 km na Rua José Francisco Kuhnen",0.0,150000.0,
41825,20781,17900473000148,MUNICIPIO DE GUARANESIA,INSTALAÇÃO DE SECADOR DE CAFÉ,0.0,100000.0,
73088,15674,17710096000184,MUNICIPIO DE ESTRELA DALVA,PAVIMENTAÇÃO DE VIAS,0.0,450000.0,
65747,11201,12261228000114,MUNICIPIO DE SAO JOSE DA TAPERA,"URBANIZAÇÃO E REVITALIZAÇÃO DA ORLA DA LAGOA CAIÇARA NO MUNICÍPIO DE SÃO JOSÉ DA TAPERA/AL.
_____________________________________________________________________________________________________
MANUTENÇÃO PREDIAL/ADEQUAÇÃO DE ESPAÇOS ESPORTIVO E RECREATIVO NAS ESCOLAS.",600000.0,1400000.0,
33232,4292,28521748000159,MUNICIPIO DE NITEROI,Apoio a projetos culturais no município de Niterói,244381.0,724111.0,
72624,385,76950096000110,MUNICIPIO DE UBIRATA,"Os recursos provenientes da emenda especial serão aplicados de acordo com as necessidades do município, visando investimentos que fortaleçam as políticas públicas locais. Todas as ações serão conduzidas em conformidade com os princípios de eficiência, transparência e benefício direto à população.",0.0,500000.0,
35938,28504,05105283000150,MUNICIPIO DE CAMETA,Serviços de terraplanagem de 20 km de vias de acesso ,0.0,1000000.0,
71038,1359,76995323000124,MUNICIPIO DE MARIOPOLIS,Construção de 03 (três) pontes no Bairro Grigolo.,0.0,1000000.0,
3636,10044,17947581000176,MUNICIPIO DE MURIAE,"Construção de Ponte em estrutura mista, zona rural da Comunidade do São João do Glória, coordenadas 21°2'44.61"" S, 42°17'19.02"" O ",0.0,250000.0,MG
12186,17683,84306497000160,MUNICIPIO DE JORDAO,Aquisição de Veículo tipo caminhonete para escoamento da produção agrícola.,0.0,300000.0,
69347,532,44563591000180,MUNICIPIO DE BERNARDINO DE CAMPOS,"Transporte de Alunos ensino superior e técnico. Bernardino de Campos, município de pequeno porte  não possui  instituições de ensino superior ou técnico, dessa forma nossos jovens tem que deslocar-se para municípios da região. As faculdades em sua maioria são pagas e nossos alunos em sua maioria, provenientes de famílias em situação de vulnerabilidade, tinham dificuldade para custear os estudos e transporte. Quando iniciamos a concessão do transporte gratuito tivemos o aumento significativo de 60% a mais de matrículas em faculdades. Atualmente atendemos em média 300 alunos para os municipios de Ourinhos, Avaré, Jacarezinho; Ipaussu e Santa Cruz do Rio Pardo. Acreditamos que o futuro de nossos jovens está na capacitação e educação. ",1200000.0,0.0,
33118,14407,18715532000170,POLICIA CIVIL DO ESTADO DE MINAS GERAIS,Transferência Especial para Aquisição de equipamentos para a unidade do IML da Policia Civil no município de Governador Valadares-MG.,0.0,150000.0,
36158,1646,34626416000131,MUNICIPIO DE NOVO REPARTIMENTO,"INVESTIMENTO NO DESENVOLVIMENTO DA SAÚDE PÚBLICA, GARANTINDO O CRESCIMENTO MUNICIPAL.",0.0,500000.0,
41758,702,63762058000192,MUNICIPIO DE CACAULANDIA,Ampliação do Sistema de Abastecimento de Água de Cacaulândia,0.0,200000.0,
67923,10949,10348050000118,MUNICIPIO DE SOLIDAO,CONSTRUÇÃO/INSTALAÇÃO DE ESTAÇÕES DE TRATAMENTO DE ESGOTO.,0.0,500000.0,
34626,5082,08148462000162,MUNICIPIO DE ALEXANDRIA,obras e equipamentos comunitários,0.0,1296841.0,
72976,14641,18301002000186,MUNICIPIO DE BOM DESPACHO,Reforma/ampliação da Biquinha,0.0,400000.0,
72149,2293,76205814000124,MUNICIPIO DE MARECHAL CANDIDO RONDON,Recape sobre pedras irregulares em trecho de estrada rural da Linha Arara,0.0,500000.0,
36648,33389,06553630000170,MUNICIPIO DE ANISIO DE ABREU,"Ação: 27.813.007.1024 - Construção de Praça Esportiva no Bairro Ribeirão
Ação: 27.813.007.1061 - Aquisição de Imóvel para Construção de Praça de Eventos
Ação: 15.452.011.1021 - Ampliação e Urbanização de Cemitérios
Ação: 20.544.015.1083 - Reforma e Ampliação de Barragens
Ação: 17.511.014.1085 - Implantação do Sistema de Abastecimento de Água",0.0,1500000.0,
70710,1320,93235943000184,MUNICIPIO DE MARATA,Cap. Rua Alberto Reidel ,0.0,100000.0,
38301,24264,18602094000134,MUNICIPIO DE TIROS,AQUISIÇÃO DE MATERIAL PERMANENTE.,0.0,400000.0,
14420,28829,34841267000123,SECRETARIA DE ESTADO DO DESENVOLVIMENTO URBANO E INFRAESTRUTURA - SEDURBI,AMPLIAÇÃO E REFORMA IHGSE,0.0,150000.0,
34113,30002,46634069000178,MUNICIPIO DE ARACOIABA DA SERRA,CONSTRUÇÃO DE CENTRO COMUNITÁRIO,0.0,200000.0,
67767,354,18307389000188,MUNICIPIO DE BRAUNAS,O executor é o beneficiário,0.0,150000.0,
20709,1556,03501509000106,MUNICIPIO DE CAMPO GRANDE,"Execução de Obras padronizadas para a construção de praças sob demanda, (Ministério do Esporte - Ação Orçamentária 00SL - Apoio à implantação e modernização de infraestrutura para esporte amador, educacional, recreativo e de lazer)",0.0,1026932.0,
70724,13867,87613055000155,MUNICIPIO DE CHIAPETTA,Transporte rodoviário,0.0,400000.0,
74104,2762,25061722000187,MUNICIPIO DE BURITI DO TOCANTINS,CONSTRUÇÃO DA PRAÇA DA ENTRADA DA CIDADE,0.0,1500000.0,
19437,33795,06096655000191,MUNICIPIO DE AFONSO CUNHA,Destinação dos recursos oriundos da Emenda Parlamentar: 202237810003-ZÉ CARLOS,0.0,450000.0,
10588,22486,10572071000112,SECRETARIA DE EDUCACAO E ESPORTES,Aquisição de Kit Escola Conectada NÍVEL INTERMEDIÁRIO,45000.0,105000.0,
66603,11970,09556006000114,FUNDO MUNICIPAL DE SAUDE,"O recurso será utilizado para aquisição de medicamentos, pagamento de exames médicos, e custeio da Secretaria  Municipal de saúde.",250000.0,0.0,
11488,27791,08358046000199,MUNICIPIO DE SEVERIANO MELO,"CONSTRUÇÃO DE QUADRA DE ESPORTE NA COMUNIDADE RURAL DE BOA VISTA II, NO MUNICIPIO DE SEVERIANO MELO/RN.",0.0,100000.0,
65612,3309,94703964000140,MUNICIPIO DE GRAMADO DOS LOUREIROS,"REFORMA E MELHORAMENTO NA PRAÇA MUNICIPAL
Com esse projeto, o município de Gramado dos Loureiros busca a revitalização da praça municipal  que sofreu ao longo dos anos diversos desgastes naturais, decorrentes do tempo e da intensa utilização.
Essa revitalização é de suma importância para a comunidade que carece de um local adequado para lazer de suas famílias, uma vez que a ação de interação entre as pessoas facilita mais o seu bem-estar, além de contribuir para fortalecer o clima de harmonia entre as pessoas, já que a atual situação em que se encontra o nosso meio social carece de iniciativas como essa que proporcionam ações de lazer e contribuem para a melhor qualidade de vida",0.0,350000.0,
4273,123,82575812000120,MUNICIPIO DE PORTO BELO,"Construção de Trapiche, no município de Porto Belo/SC.",0.0,300000.0,
4034,26944,11820102000170,FUNDO MUNICIPAL DE SAUDE DE PALESTINA DO PARA,SERVIÇOS REMANESCENTE DA REFORMA DA UNIDADE MISTA DE SAÚDE JOSÉ HOMOBONO PAZ DE ANDRADE (HOSPITAL MUNICIPAL).,0.0,87299.99,PA
33283,16236,46522959000198,MUNICIPIO DE MAUA,"1 - Objeto: Reforma da Passarela Central - A referida passarela atende a população que circulas pelo centro da cidade - que é dividida pela linha férrea.
2 - Objeto: reforma da passagem de pedestre no bairro - A referida passagem atende moradores do Bairro Zaíra. ",0.0,1250000.0,
66580,2189,18338293000187,MUNICIPIO DE SIMAO PEREIRA,Pavimentaçãode Vias Urbanas no município,0.0,500000.0,
67140,362,92410422000153,MUNICIPIO DE SAGRADA FAMILIA,Construção de Quadra Society,0.0,300000.0,
16409,426,08085417000106,MUNICIPIO DE SAO RAFAEL,Construção de equipamentos esportivos,0.0,180682.0,
16430,1984,83334698000109,MUNICIPIO DE SANTA BARBARA DO PARA,Serviço de reforma da Unidade Básica de Saúde do Pau D'arco. ,240000.0,560000.0,
9621,31237,88073291000199,MUNICIPIO DE BAGE,Aquisição de Elevador para acessibilidade da futura instalação do Museu de Lã no município de Bagé.,0.0,200000.0,
4034,26864,83211417000120,MUNICIPIO DE PALESTINA DO PARA,"a) INVESTIMENTO NA CONSTRUÇÃO DE UMA QUADRA DE ESPORTE, LOCALIZADA NA VILA POSTO FISCAL, ZONA RURAL DE PALESTINA DO PARÁ/PA.
b) INVESTIMENTO NA CONSTRUÇÃO DE UMA QUADRA DE ESPORTE LOCALIZADA NA VILA PORTO DA BALSA, ZONA RURAL DE PALESTINA DO PARÁ/PA, 
c) IMPLANTAÇÃO DE ILUMINAÇÃO DO ESTÁDIO DE PALESTINA DO PARÁ/PA.",0.0,212700.01,PA
16873,6948,46522991000173,MUNICIPIO DE JANDIRA,Revitalização espaço cultural Biguá,0.0,100000.0,
69160,12125,08113631000129,MUNICIPIO DE PARAZINHO,PAVIMENTAÇÃO,0.0,300000.0,
72207,13892,16137291000102,MUNICIPIO DE AURELINO LEAL,AÇÕES EM INFRAESTRUTURA URBANA,0.0,400000.0,
12813,27320,01634074000142,MUNICIPIO DE AGUIARNOPOLIS,PAVIMENTAÇÃO DE RUAS,0.0,350000.0,
33099,6516,67995027000132,MUNICIPIO DE HORTOLANDIA,Aquisição de equipamentos esportivos,0.0,850000.0,
36150,28429,05853163000130,MUNICIPIO DE MARABA,Aquisição de veículo para transporte de alunos incluídos no NAETEA,0.0,100000.0,
18525,617,88587183000134,MUNICIPIO DE CARLOS BARBOSA,CERCAMENTO DA QUADRA DE AREIA DA PRAÇA DE ARCOVERDE,0.0,100000.0,
34292,2230,88594999000195,MUNICIPIO DE GARIBALDI,Construção de novos vestiários no campo São Francisco,0.0,100000.0,
70058,3724,10584440000197,POLICIA CIVIL DO ESTADO DO ACRE - PCAC,Aquisição de equipamentos de academia para Delegacia de Polícia de Sena Madureira-AC.,0.0,300000.0,
10847,69,77857183000190,MUNICIPIO DE GUAIRA,MANUTENÇÃO DAS ATIVIDADES DE LIMPEZA PÚBLICA,0.0,100000.0,
10486,527,94704004000102,MUNICIPIO DE BARRA FUNDA,Execução de pavimentação asfáltica,0.0,150000.0,
75184,11828,08364655000150,MUNICIPIO DE RIACHUELO,AQUISIÇÃO DE ÔNIBUS ESCOLAR E REALIZAÇÃO DE PAVIMENTAÇÃO EM PARALELEPÍPEDO NA ZONA URBANA DO MUNICÍPIO DE RIACHUELO/RN.,0.0,800000.0,
10585,18190,76975259000110,MUNICIPIO DE SAO PEDRO DO PARANA,"EXECUÇÃO DE OBRA DE RECONSTRUÇÃO DA PONTE RURAL SOBRE O RIBEIRÃO SÃO PEDRO, ESTRADA LEONI, no município de São Pedro do Paraná, construção que melhorará o escoamento da produção agrícola e pecuária desde o pequeno ao grande produtor, pois a estrada é uma importante ligação, garantindo melhores condições de transporte para insumos, equipamentos e produtos agrícolas, além do acesso dos produtores rurais as suas propriedades.",0.0,200000.0,
15395,26323,02382836000123,MUNICIPIO DE RUBIATABA,Continuação da construção da garagem do municipio de Rubiataba/GO. ,0.0,80000.0,
75166,8927,84317205000195,FUNDO MUNICIPAL DE SAUDE,"Equipar o Departamento de Controle de Zoonoses com recursos materiais, tecnológicos e de infraestrutura adequados para melhorar a capacidade de monitoramento, prevenção e controle de zoonoses - Conforme Plano de trabalho detalhado em anexo.",0.0,300000.0,
14783,653,34626440000170,MUNICIPIO DE BREU BRANCO,Execução de serviços de Revitalização da praça na vila Mojuzinho e da praça na Vila de Placas na zona rural no município de Breu Branco,0.0,400000.0,
74531,1476,17947623000179,MUNICIPIO DE MIRADOURO,Obras Pronto Atendimento,0.0,800000.0,
13190,1988,04194239000109,MUNICIPIO DE SANTA ISABEL DO RIO NEGRO,CONSTRUÇÃO DE CASA DE APOIO AO INDIGENA NO MUNICIPIO DE SANTA ISABEL DO RIO NEGRO/AM,0.0,300000.0,
32500,31238,01612619000110,MUNICIPIO DE JULIO BORGES,"CONSTRUÇÃO DE PONTE EM CONCRETO ARMADO - PONTE DO LAMEIRAOZINHO - ZONA RURAL DO MUNICÍPIO DE JÚLIO BORGES

COLOCAÇÃO DE GRAMA SINTÉTICA E ILUMINAÇÃO DO ESTÁDIO MUNICIPAL JÚLIO BORGES

CONSTRUÇÃO DE CAMPO SOCIETY NO MUNICÍPIO DE JÚLIO BORGES

AMPLIAÇÃO DE PRAÇA DE EVENTOS NO MUNICÍPIO DE JÚLIO BORGES",0.0,1000000.0,
64855,29998,13937057000163,"SECRETARIA DA AGRICULTURA, PECUARIA, IRRIGACAO, PESCA E AQUICULTURA- SEAGRI",Aquisição de máquinas pesadas e trator agrícola,0.0,4292425.0,
69174,901,80912140000175,MUNICIPIO DE SANTA HELENA,"CONSTRUÇÃO DE UM GALPÃO INDUSTRIAL COM ÁREA DE 737,57M² PARA FOMENTO A INDUSTRIA",0.0,250000.0,
17570,32041,17694852000129,MUNICIPIO DE BUENOPOLIS,Melhoria da Infraestrutura Urbana,0.0,200000.0,
64803,721,01180645000116,MUNICIPIO DE CRISTIANOPOLIS,"reforma e ampliação da prefeitura Rua Wilson da paixão número 1 setor central. Cep 75230-000 817,82 m2
",0.0,500000.0,
18825,1647,05421300000168,MUNICIPIO DE SAO FELIX DO XINGU,"FUNDO MUNICIPAL DE ASSISTENCIA
UNIDADE ORÇAMENTARIA 1011
FUNÇÃO PROGRAMATICA 08 244 0005 1 066
CATEGORIA ECONOMICA 4 4 90 51 00
FONTE DE RECURSO 15000000",0.0,500000.0,
