id_plano_acao,id_executor,cnpj_executor,nome_executor,objeto_executor,vl_custeio_executor,vl_investimento_executor,uf_beneficiario_plano_acao
73189,1513,01505643000150,MUNICIPIO DE CATALAO,Execução de obras e instalações no Município de Catalão e aquisição de equipamentos para o PRO SAUDE.,0.0,1218236.0,
71145,4004,07209225000100,MUNICIPIO DE ITANHANGA,Aquisisção de veiculo de transporte sanitário,0.0,300044.0,
33204,16310,84306604000150,MUNICIPIO DE CAPIXABA,"Aquisição de maquinários, equipamentos e implementos agrícolas 
Custeio para manutenção das atividades realizadas pelas secretarias de administração e finanças e obras ",782020.0,1824714.0,
36159,15155,83211391000110,MUNICIPIO DE SAO DOMINGOS DO ARAGUAIA,"Contratação de empresa para aquisição de cimento para uso geral, para atender as necessidades da fábrica de pré-moldados do município de São Domingos do Araguaia/PA. ",0.0,500000.0,
66141,971,46588950000180,MUNICIPIO DE SAO JOSE DO RIO PRETO,"Empreitada de mão de obra com fornecimento de materiais a execução da obra de construção de sanitários no Recinto de Exposições Alberto Bertelli Lucatto (Rua Daniel Antonio de Freitas, 115, Distrito Industrial).",0.0,500000.0,
65356,14937,13113063000104,MUNICIPIO DE ITABI,AQUISIÇÃO DE TERRENO PARA CONSTRUÇÃO DE CASAS POPULARES,0.0,1000000.0,
10770,3235,04223461000184,MUNICIPIO DE GAMELEIRA DE GOIAS,Construção de rede de galeria pluvial na rua Dimas Alcantara; Construção do Cristo Redentor da Cidad; Manutenção de vias públicas; Reconstrução da ponte da região da madeira.,0.0,300000.0,
38580,973,30417158000122,MUNICIPIO DE ITALVA,"Urbanização da Rua Pedro Alves de Souza + Aditivo (Parcial)
Urbanização da Rua Adelcio Canuto + Aditivo
",0.0,853977.0,
69496,967,87613212000122,MUNICIPIO DE ERVAL SECO,"Construção de um palco em um ginásio de esportes, em uma comunidade do Município.",0.0,150000.0,
15954,29165,10404184000109,MUNICIPIO DE OLINDA,"OBS.: A EMENDA FOI DESTINADA PARA DOIS OBJETOS, INVESTIMENTO E CUSTEIO, ABAIXO OS OBJETOS:

1) INVESTIMENTO: EXECUÇÃO DE PAVIMENTAÇÃO DA RUA ANA MOREIRA LINS CALDA, NO BAIRRO DE OURO PRETO, ÁREA URBANA DO MUNICÍPIO DE OLINDA/PE. (1.597,86m²)

2) CUSTEIO: O TERMO DE FOMENTO TEM POR OBJETIVO A FORMALIZAÇÃO DA RELAÇÃO DE PARCERIA , EM REGIME DE MÚTUA COOPERAÇÃO ENTRE O MUNICÍPIO E A O.S.C. PARA CONSECUÇÃO DE FINALIDADES DE INTERESSE PÚBLICO E RECÍPROCO, MEDIANTE A EXECUÇÃO DO PROJETO RECONNECTORS - CONEXÃO OLINDA, A SER REALIZADO PELA OSC PARCERIA.",150000.0,200000.0,
9326,16315,18114256000195,MUNICIPIO DE CAIANA,CALÇAMENTO EM BLOQUETE EM VIAS  PÚBLICA VICINAL NA COMUNIDADE DO BANANAL LOCALIZADA EM AREA RURAL DENTRO DO PERIMETRO URBANO DO MUNICIPIO DE CAIANA.,0.0,200000.0,
3885,29424,44518397000183,MUNICIPIO DE LUPERCIO,15.451.0291.1180.0000 - SUBSTITUIÇÃO DE TÉCNOLOGIA DE ILUMINAÇÃO PÚBLICA,0.0,150000.0,SP
10785,23231,76017474000108,MUNICIPIO DE GUARATUBA,"Serviços de engenharia, revestimento em CBQU.",100000.0,400000.0,
75252,1036,88546890000182,MUNICIPIO DE SANTA ROSA,"Aquisição de equipamentos para aparelhamento da EMEF Cívico-Militar Cel. Raul Oliveira - contemplando equipamentos eletrônicos, informática, esportivo, mobiliário, entre outros.",0.0,100000.0,
13498,32052,06554059000108,MUNICIPIO DE ELISEU MARTINS,Aquisição de Equipamentos Agricolas.,0.0,100000.0,
10369,23326,01740588000182,MUNICIPIO DE GUARANI DE GOIAS,EXECUÇÃO DE OBRA DE PAVIMENTAÇÃO ASFÁLTICA EM VIAS PUBLICAS,244993.0,0.0,
14880,747,46787644000172,MUNICIPIO DE CAMPOS NOVOS PAULISTA,custeio na atenção básica ,80000.0,0.0,
19490,1694,94707486000146,MUNICIPIO DE LINDOLFO COLLOR,Aquisição de veículo de 15 lugares para saúde,0.0,250000.0,
10778,1755,02647303000126,MUNICIPIO DE PILAR DE GOIAS,Pavimentação de vias públicas,0.0,300000.0,
73059,3779,01613077000108,MUNICIPIO DE PERIQUITO,"(1) Implantação de sistema de abastecimento de água e esgotamento sanitário da Rua Sapucaia. Distrito de Serraria - Município de Periquito/MG;
",0.0,100000.0,
74938,2083,44573087000161,MUNICIPIO DE TUPA,Recapeamento Asfáltico de Vias Públicas no Perímetro Urbano do Município de Tupã ,0.0,500000.0,
75196,9102,08241747000143,MUNICIPIO DE NATAL,Fortalecer a Guarda Municipal de Natal – GMN por meio da Reforma do Centro Administrativo da Guarda Municipal de Natal/RN.,0.0,100000.0,
72570,15588,76105667000110,MUNICIPIO DE AGUDOS DO SUL,Construção de pontes e pavimentação de vias públicas,0.0,800000.0,
36079,15756,87344016000108,MUNICIPIO DE PORTAO,"É objeto deste contrato, a execução dos serviços de pavimentação asfáltica (CBUQ), com área total de 7.292,64m², drenagem pluvial e sinalização viária: - Rua Iraí: 2.287,36m²;
- Rua Taquari: 2.261,84m²; e - Rua Triunfo: 2.743,44m²",0.0,150000.0,
68181,1815,10105955000167,MUNICIPIO DE ARCOVERDE,"PAVIMENTAÇÃO DE DIVERSAS RUAS LOCALIZADAS EM MÚLTIPLOS BAIRROS NO MUNICÍPIO DE ARCOVERDE/PE E REFORMA DO TRECHO II E TRECHO III, DA PRAÇA BARBOSA LIOMA E FORNECIMENTO E INSTALAÇÃO DA ACADEMIA DO TRECHO I.",0.0,500000.0,
20593,1360,01173053000177,MUNICIPIO DE AGUA LIMPA,"Pavimento intertravado sextavado (blokret) – 30X30X8cm, pré-fabricado FCK=25 MPA",0.0,400000.0,
73469,1734,18404947000123,MUNICIPIO DE OURO VERDE DE MINAS,Pavimentação de vias na sede do município.,0.0,1000000.0,
68283,61,36350312000172,MUNICIPIO DE SAO DOMINGOS DO NORTE,"O recurso repassado via transferência especial será utilizado para a execução de pavimentação rural em trechos estratégicos do município de São Domingos do Norte, sob a coordenação da Secretaria Municipal de Agricultura. Este projeto é de extrema importância para o fortalecimento da agricultura local, pois a pavimentação das vias rurais facilitará o acesso às propriedades, melhorando o escoamento da produção e reduzindo os custos de transporte. Além disso, a iniciativa contribui para a segurança e eficiência das operações agrícolas, promovendo o desenvolvimento econômico e a qualidade de vida no campo.",0.0,1000000.0,
12103,409,88566872000162,MUNICIPIO DO RIO GRANDE,"O recurso será utilizado em:
- Obra de revitalização da Av. Beira Mar
- Obra de reforma na cobertura da EMEI Tia Luizinha
- Aquisição de equipamentos para a EMEF Alcides Barcelos",0.0,1000000.0,
16069,26824,18712158000150,MUNICIPIO DE SAO GONCALO DO SAPUCAI,"Pavimentação e terraplanagem em área urbana
Avenida Ibrahim de Carvalho (Empenho  2078/2023)
Novo Horizonte e Centro (2823/2023)",0.0,200000.0,
68462,7576,47842836000105,MUNICIPIO DE FERNANDOPOLIS,"Recapeamento Asfáltico em Concreto Betuminoso Usinado a Quente “CBUQ” com espessura de 3,0cm, em diversas vias públicas do município de Fernandópolis/SP.",0.0,200000.0,
68607,1908,04018560000124,MUNICIPIO DE XAPURI,"AQUISIÇÃO DE COMBUSTIVEL, PARA MELHORIAS DE ESTRADAS VICINAIS E MANUTENÇÃO DE VEÍCULOS E MAQUINAS PESDAS",500000.0,0.0,
11237,32054,95684478000194,MUNICIPIO DE CANDOI,"Execução da Pavimentação Poliédrica em trecho da Estrada Rural da Comunidade da Vila Nova, localizada na zona rural do município de Candói.

",0.0,200000.0,
17677,25858,18260489000104,MUNICIPIO DE TUPACIGUARA,RECAPEAMENTO EM VARIAS RUAS NO MUNICÍPIO DE TUPACIGUARA MG ZONA URBANA ,0.0,1200000.0,
68299,1514,75587204000170,MUNICIPIO DE TERRA ROXA,Melhoramento da Infraestrutura Esportiva do Município de Terra Roxa/PR na sede e distritos.,0.0,300000.0,
71930,2730,13752415000163,MUNICIPIO DE FIRMINO ALVES,Pavimentação asfáltica de ruas no Município de Firmino Alves-BA.,0.0,2000000.0,
65041,1900,41522368000105,MUNICIPIO DE JACOBINA DO PIAUI,Realização de exposição de ovinos e caprinos e melhorias na iluminação pública de Jacobina do Piauí.,84760.0,216672.0,
70202,2728,06554455000135,MUNICIPIO DE BURITI DOS LOPES,Investimento qualidade de vida população de Buriti dos Lopes/PI,0.0,321800.0,
67368,19770,27167394000123,MUNICIPIO DE IUNA,"Aquisição de  veiculo para regaste dos animais errantes que estão nas ruas , socorrer de possíveis acidentes ,para recolher doações ,  transportar materiais doados para realização de Bazar .
Custeio será utilizada na castração , microchipagem , campanhas de adoção e concientização , manutenção do abrigo , e materiais de consumo .
",50000.0,100000.0,
20557,31299,13698758000197,MUNICIPIO DE UAUA,OBRAS ESTRUTURANTES,0.0,400000.0,
20014,1515,83169623000110,MUNICIPIO DE JOINVILLE,"Obras e serviços de engenharia para revitalização e urbanização da localidade denominada Vila Vigorelli,",0.0,1500000.0,
69722,989,88488358000156,MUNICIPIO DE NOVA PALMA,Aquisição Equipamentos para o Município de Nova Palma/RS,0.0,150000.0,
65949,994,10347466000111,MUNICIPIO DE FLORES,"
FESTIVIDADES E INFRAESTRUTURA URBANA",90000.0,210000.0,
74382,90,45780079000159,MUNICIPIO DE JARINU,Construção de quadra esportiva,0.0,242896.0,
15157,2076,87613204000186,MUNICIPIO DE RODEIO BONITO,Aquisição de equipamentos para a secretaria da educação do município de Rodeio Bonito/RS.,0.0,100000.0,
67067,9152,01617873000100,MUNICIPIO DE HERVEIRAS,"AQUISIÇÃO DE UMA ESCAVADEIRA HIDRÁULICA NOVA. ZERO HORA. PESO OPERACIONAL MAIOR OU IGUAL A 12500 KG E MENOR OU IGUAL A 14999 KG. TIPO A. DESTINADA PARA A SECRETARIA MUNICIPAL DE AGRICULTURA PARA PRESTAR SERVIÇOS DE FOMENTO E INCENTIVO À PRODUÇÃO AGROPECUÁRIA PARA OS AGRICULTORES FAMILIARES RESIDENTES TANTO NA ÁREA RURAL QUANTO URBANA NO MUNICÍPIO DE HERVEIRAS. CABE RESSALTAR QUE O MUNICÍPIO POSSUI SUA ECONOMIA BASEADA NAS ATIVIDADES AGRÍCOLAS, INCLUSIVE A AREA URBANA POSSUI BASTANTE IMÓVEIS QUE DESENVOLVEM ATIVIDADES AGRÍCOLAS.",0.0,250000.0,
12130,2715,44892693000140,MUNICIPIO DE CARAPICUIBA,"Contrato 37/2022 - Objeto: Ampliação recapeamento asfáltico e execução de calçadas na Av. Antonio Faustino dos Santos – fases I e II e novo viário do Ginásio Ayrton Sena neste município; Empresa: Tecla Construções;
Contrato 34/2022 - Objeto: Construção de passagem de nível na Av. Deputado Emílio Carlos com interligação ao terminal metropolitano intermunicipal neste município, Empresa: Tecla Construções",0.0,1000000.0,
75080,2962,83102731000175,MUNICIPIO DE TROMBUDO CENTRAL,PAVIMENTAÇÃO ASFÁLTICA DA RUA AFONSO CEOLIN,0.0,600000.0,
69564,33798,04012548000102,MUNICIPIO DE CRUZEIRO DO SUL,AQUISIÇÃO DE LOTES (TERRENOS) PARA O MUNICÍPIO DE CRUZEIRO DO SUL/AC.,0.0,500000.0,
16025,2105,44892693000140,MUNICIPIO DE CARAPICUIBA,"Eventos Culturais: 1. 50 Anos de Hip Hop. 2. Cultura na Quebrada.
Publicação de dados oficiais ",100000.0,0.0,
3752,30853,20622890000180,MUNICIPIO DE GOVERNADOR VALADARES,"Reforma da quadra Poliesportiva no Distrito de Nova Floresta, no Município de Governador Valadares/MG",0.0,269723.0,MG
32619,33786,08004061000139,MUNICIPIO DE CEARA-MIRIM,"Unidade Orcamentária: 02.019 - SECRETARIA MUNICIPAL DE DEFESA SOCIAL
FUNÇÃO: 06 - SEGURANÇA PÚBLICA
SUBFUNÇÃO: 182 - DEFESA CIVIL
Programa: 0016 - GESTÃO PÚBLICA DE EXCELÊNCIA
Projeto/atividade: 1070 - Apoio à Segurança preventiva Contra Criminalidade e Violência nas Escolas e Comunidades
Natureza da despesa: 4.4.90.52- EQUIPAMENTOS E MATERIAL PERMANENTE
",0.0,220000.0,
10818,3001,37421146000110,MUNICIPIO DE RECURSOLANDIA,Construção de Escola no Assentamento Barra Mansa.,0.0,640000.0,
67426,2322,92403583000110,MUNICIPIO DE VISTA ALEGRE,"Execução de Melhorias em Espaços Comunitários  e Esportivos - 140.000,00
Aplicação dos recursos para atendimento das demandas da área da saúde do Município de Vista Alegre - R$ 60.000,00 ",60000.0,140000.0,
20701,30854,03155926000144,MUNICIPIO DE DOURADOS,Aquisição de Equipamentos Permanentes.,0.0,251733.0,
69213,20226,03173317000118,MUNICIPIO DE NOVA ANDRADINA,CONSTRUÇÃO DE UMA COBERTURA DE ESTRUTURA METÁLICA DE UMA QUADRA POLIESPORTIVA NO BAIRRO PORTAL DO PARQUE.,0.0,400000.0,
34974,29426,13811807000156,MUNICIPIO DE UTINGA,Pavimentação de Vias Urbanas no município.,0.0,4000000.0,
14610,25655,11097359000145,MUNICIPIO DE JOAO ALFREDO,Ampliação de serviços públicos  e infraestrutura no município de João Alfredo,100000.0,500000.0,
68756,5196,45767829000152,MUNICIPIO DE CACONDE,Revitalização da Praça dos Cristais,0.0,200000.0,
72842,27454,80913031000172,MUNICIPIO DE OURO VERDE,aquisicao de caminhao basculante,0.0,200000.0,
64828,1806,13097050000180,MUNICIPIO DE ESTANCIA,"Aquisição de Equipamentos Guarda Municipal
Prestação de serviços de castração de animais caninos e felinos machos no Município de Estância
Contratação de empresa para recebimento de resíduos sólidos domiciliares e comerciais (Aterro Sanitário)",200000.0,250000.0,
15380,20784,01595320000102,MUNICIPIO DE BANNACH,"AQUISIÇÃO DE PEÇAS, INSUMOS E COBUSTIVEIS PARA AS ATIVIDADES DAS SECRETARIAS DE OBRAS, ADMINISTRAÇÃO E AGRICULTURA DO MUNICIPIO",300000.0,0.0,
10497,998,91693325000152,MUNICIPIO DE BARAO,"PAVIMENTAÇÃO COM BLOCOS INTERTRAVADOS DE CONCRETO TIPO “S” (PVS), NA ESTRADA MUNICIPAL DE LINHA GENERAL NETO",0.0,200000.0,
33332,27129,46523064000178,MUNICIPIO DE CAIEIRAS,Recapeamento Asfáltico em diversas ruas do Jardim Marcelino - Ruas São Paulo e Santo Antônio Jd. São Francisco Caieiras/SP,0.0,1000000.0,
75161,7083,02396166000102,MUNICIPIO DE PEIXE,IMPLANTAÇÃO DE USINA SOLAR FOTOVOLTAICA CONECTADA A REDE,0.0,1195214.0,
15832,5436,01612343000170,MUNICIPIO DE RIACHAO DO BACAMARTE,Aquisição de terrenos ,0.0,250000.0,
30956,14476,18715573000167,"SECRETARIA DE ESTADO DE AGRICULTURA, PECUARIA E ABASTECIMENTO","Transferência Especial para aquisição de Patrulha Agrícola Mecanizada para os municípios de Águas Formosas, Arceburgo, Bonito de Minas, Coimbra, Januária, Lassance, Maripá de Minas, MAto Verde, Novo Cruzeiro, Pequeri, Ponto Chique, Poté, Tabuleiro, Alto do Rio Doce.

Público beneficiado: Agricultores familiares, de pequenos e médios portes e produtores rurais.",0.0,2500000.0,
11895,1902,08113466000105,MUNICIPIO DE LAJES,Construção de um polo da academia da ´saúde ,0.0,150000.0,
74934,8954,45685872000179,MUNICIPIO DE REGISTRO,"Pavimentação asfáltica e obras complementares na Rua Jarbas Rocha - Vila Ponce - Fase II e Aquisição de equipamentos de informática para as Unidades de Saúde.
",0.0,200000.0,
64999,3780,04426383000115,MUNICIPIO DE TEFE,construção de calçada meio fio e sarjeta,0.0,1250000.0,
67630,13873,45685120000108,MUNICIPIO DE PARIQUERA-ACU,"Recuperação asfáltica em pontos localizados da Av. Dr. Carlos Botelho, Centro, no município de Pariquera-Açu.",0.0,200000.0,
38321,1919,92122753000198,MUNICIPIO DE SAO JOSE DO HORTENCIO,Reforma Centro de Referencia da Assistencia Social (CRAS),0.0,100000.0,
68223,997,82892357000196,MUNICIPIO DE RANCHO QUEIMADO,"Objeto: execução da obra de pavimentação asfáltica, drenagem e sinalização viária da Rua Silvio Goedert - Etapa 03, estacas 46 até à estaca 126, totalizando 1.600 metros, no Bairro Mato Francês, em Rancho Queimado/SC
",0.0,3000000.0,
10900,25864,44919611000103,MUNICIPIO DE INUBIA PAULISTA,AQUISIÇÃO DE EQUIPAMENTOS E CLIMATIZADORES PARA O CENTRO COMUNITÁRIO,0.0,100000.0,
10799,21878,75368928000122,MUNICIPIO DE MAMBORE,Infraestrutura Urbana e Lazer,0.0,350000.0,
16155,30855,16445843000131,MUNICIPIO DE ITAGUACU DA BAHIA,"ADEQUAÇÃO E RECUPERAÇÃO  DE ESTRADAS VICINAIS
INVESTIMENTOS DIVERSOS",0.0,1419682.0,
14908,32053,01612602000162,MUNICIPIO DE PAJEU DO PIAUI,"Pavimentação da Localidade Vila Carpina, zona Rural do município de Pajeú do Piauí - PI.",0.0,400000.0,
32059,1735,02647303000126,MUNICIPIO DE PILAR DE GOIAS,Promoção de eventos locais,80000.0,0.0,
36511,33800,02306900000197,MUNICIPIO DE TAGUATINGA,AÇÕES DE INFRAESTRUTURA URBANA NO MUNICI´PIO DE TAGUATINGA-TO,0.0,500000.0,
75310,3236,01169416000109,MUNICIPIO DE LUZIANIA,"Pavimentação Asfáltica, drenagem superficial, drenagem profunda e sinalização viária no trecho da Avenida Osmar Soares de Queiroz, no perímetro urbano do Município de Luziânia - Goiás.
",0.0,2700000.0,
13439,447,13646005000138,MUNICIPIO DE ALAGOINHAS,Obras de Drenagem Canal do Bairro Silva Jardim e pavimenbtação de vias no Município de Alagoinhas-BA ,0.0,500000.0,
21339,33801,13913371000106,MUNICIPIO DE MIRANGABA,Aquisição de combustível para utilização nas máquinas e equipamentos que dão manutenção às estradas vicinais ,0.0,590000.0,
65901,669,44563591000180,MUNICIPIO DE BERNARDINO DE CAMPOS,"Realização de eventos tradicionais municipais Festividades Aniversário município - Outubro e Final de ano (Natal e Ano Novo) 
Bernardino de Campos ainda mantém a tradição como Folia de Reis que esse ano completa 96 anos de existência, além do calendário de atividades culturais  que incluem Festival de Verão com a apresentação de artistas e concentração na Praça da Matriz de nossos artesãos locais e entidades sócio assistenciais que participam, expondo seus trabalhos e trazendo a comunidade para o local. FESTAR - Festival de Teatro Amador que está em sua 20a. edição e leva difusão cultural e entretenimento para toda a população e região.  A cultura regional é vista também nas Festas de Peão, esse ano em sua XXV Festa de Peão de Boiadeiro/Rodeio, que atrai aproximadamente 12.000 pessoas e conta com nomes consagrados de artistas e peões reconhecidos nacionalmente. Em nosso Festival de Inverno contamos com apresentações e participação a nível regional. Município pequeno e atraí em seus eventos o público regional, que gosta da tradição e do povo hospitaleiro. Pretendemos nas comemorações do aniversário da cidade um evento familiar com diversas atrações na Praça da Matriz, ponto de encontro de nossa comunidade. Nas festividades de Natal e Ano Novo com a decoração de luzes nos pontos centrais, incluindo chegada de papai Noel levaremos alegria e entusiasmo a nossa comunidade e visitantes esperados. Já na tradicional virada de ano apresentação musical na praça da matriz.

",150000.0,0.0,
75198,11043,03501509000106,MUNICIPIO DE CAMPO GRANDE,"Execução de Obras padronizadas para a construção de praças sob demanda, (Ministério do Esporte - Ação Orçamentária 00SL - Apoio à implantação e modernização de infraestrutura para esporte amador, educacional, recreativo e de lazer)",0.0,870000.0,
11315,33802,14131569000109,MUNICIPIO DE IBIRATAIA,"PAVIMENTAÇÃO EM PARALELEPÍPEDO DE VIAS PUBLICAS NO BAIRRO AABB, NA SEDE DESTE MUNICÍPIO",120000.0,280000.0,
72166,1595,95583555000110,MUNICIPIO DE IRACEMA DO OESTE,1 Reforma do Ginásio de Esportes,0.0,800000.0,
69415,1018,02506012000118,MUNICIPIO DE GOIANAPOLIS,"Custeio para Assistência Social
",50000.0,0.0,
69930,1842,75971010000173,MUNICIPIO DE MARILENA,"AQUISIÇÃO DE EQUIPAMENTOS DE RECREAÇÃO (PLAYGROUND INFANTIL);
",0.0,300000.0,
74327,3195,75352062000161,MUNICIPIO DE MUNHOZ DE MELLO,CONSTRUÇÃO DE CASAS HABITAÇÃO URBANA,0.0,350000.0,
4624,16633,02401248000190,MUNICIPIO DE BABACULANDIA,CONSTRUÇÃO CENTRO DE EVENTOS 1ª E 2ª ETAPAS,0.0,250000.0,
21381,1015,91693325000152,MUNICIPIO DE BARAO,PAVIMENTAÇÃO ASFÁLTICA – ARROIO CANOAS,0.0,100000.0,
68757,3855,01608905000101,MUNICIPIO DE ERMO,"Aquisição de 2.586,21 M³ de Saibro para Recuperação Estradas Municipais- alargamento das estradas, substituição de materiais inadequados, elevação do greide e implantação de drenagem pluvial Executado em Área Rural
TRECHO 01 - ERM 125 Garapuvu 3.100,00m - Coordenada de Inicio: Lat  29° 0'20.10""S a Long  49°40'39.16""O e Coordenada Final: Lat  29° 0'54.13""S a Long  49°39'5.89""O

TRECHO 02 - ERM 130 Garapuvu 2.200,00m - Coordenada Inicio: Lat  28°59'36.47""S a Long  49°38'46.75""O e Coordenada Final: Lat  29° 0'46.40""S a Long  49°38'45.22""O",75000.0,0.0,
37079,5215,83074310000188,MUNICIPIO DE LEBON REGIS,"Contratação de empresa especializada para execução, incluindo o fornecimento de materiais para Ampliação do CMEI Walmor Carlin do Prado.",0.0,200000.0,
18553,21623,91995373000103,MUNICIPIO DE SANTA MARIA DO HERVAL,PAVIMENTAÇÃO DE TRECHO DAS RUAS HUGO KIELING E ISABEL BOUFLEUR,0.0,150000.0,
17497,3120,37421146000110,MUNICIPIO DE RECURSOLANDIA,Infraestrutura.,0.0,150000.0,
21430,28995,05193073000160,MUNICIPIO DE SAO MIGUEL DO GUAMA,"SERVIÇOS COMUNS DE   ENGENHARIA, COM FORNECIMENTO DE MÃO DE OBRA, MATERIAIS E EQUIPAMENTOS,   NECESSÁRIOS À REFORMA, ADEQUAÇÃO, MANUTENÇÃO E REPAROS DAS ESCOLAS, PREDIOS E LOGRADOUROS PÚBLICOS VISANDO  O ATENDIMENTO DAS NECESSIDADES DAS SECRETARIAS DE   EDUCAÇÃO, SAÚDE E INFRAESTRUTURA E URBANISMO DO MUNICÍPIO DE SÃO MIGUEL DO   GUAMÁ/PARÁ ",0.0,785369.0,
38440,14416,03389126000198,CORPO DE BOMBEIROS MILITAR DE MINAS GERAIS,"Execução de obras na Academia de Bombeiros Militar em Belo Horizonte/MG
",0.0,500000.0,
68570,1343,07693989000105,MUNICIPIO DE MONSENHOR TABOSA,Pavimentação na sede do município de Monsenhor Tabosa,0.0,800000.0,
17054,4380,46200853000178,MUNICIPIO DE MACATUBA,Aquisição de veículo tipo Van adaptada que será destinado ao transporte de pacientes usuários da rede pública de saúde.,0.0,150000.0,
36912,1904,92122753000198,MUNICIPIO DE SAO JOSE DO HORTENCIO,Reforma prédio Centro de Referencia da Assistencia Social (CRAS).,0.0,100000.0,
41880,2003,04194239000109,MUNICIPIO DE SANTA ISABEL DO RIO NEGRO,AQUISIÇÃO DE MOTOSSERRAS PARA O MUNICIPIO DE SANTA ISABEL DO RIO NEGRO,0.0,30893.0,
38095,1467,76175934000126,MUNICIPIO DE IPIRANGA,"Construção de imóvel, destinado á Casa Lar no municipio de ipiranga ",0.0,272000.0,
11174,31808,13096029000160,MUNICIPIO DE CRISTINAPOLIS,"Festa de São Francisco, Padroeiro da Cidade de Cristinápolis

Reforma e Ampliação do Mercado Público de Cristinápolis",281004.0,518996.0,
71439,30474,18114223000145,MUNICIPIO DE TOMBOS,PAVIMENTAÇÃO ASFALTICA,0.0,500000.0,
71406,1523,18186346000191,MUNICIPIO DE ALAGOA,Pavimentação de vias públicas,0.0,600000.0,
15300,1845,88568902000170,MUNICIPIO DE SAO JOSE DO NORTE,- Construção de 170 metros de muro para o Campo Municipal de Futebol no Bairro Veneza dentro do perímetro urbano,0.0,200000.0,
20649,29167,18671271000134,MUNICIPIO DE OURO FINO,INFRAESTRUTURA URBANA,0.0,100000.0,
64603,11247,01612577000117,MUNICIPIO DE FRANCISCO MACEDO,Custeio em despesas diversas e investimento em obras e instalações.,200000.0,311605.0,
36499,33803,13845086000103,MUNICIPIO DE SERRINHA,Pavimentação asfáltica no município de Serrinha-ba,0.0,1258418.0,
69378,8951,45685872000179,MUNICIPIO DE REGISTRO,Pavimentação asfáltica e obras complementares na Rua Jarbas Rocha - Vila Ponce - Fase II (Investimento) e Aquisição de Insumos para Realização de Tapa Buraco para diversas ruas no perímetro urbano do munícipio de Registro (Custeio).,60000.0,140000.0,
15333,26492,18428847000137,MUNICIPIO DE PIRAJUBA,Execução de infraestrutura urbana,0.0,150000.0,
32898,23497,05990437000133,MUNICIPIO DE CALCOENE,PAVIMENTAÇÃO DE VIAS EM BLOCOS NO DISTRITO DO LOURENÇO,450000.0,1050000.0,
38246,33804,44531788000138,MUNICIPIO DE LINS,CONTRATAÇÃO DE EMPRESA PARA O FORNECIMENTO/CONSTRUÇÃO E INSTALAÇÃO COMPLETA DE RAMPAS DE ACESSIBILIDADE.,0.0,200000.0,
67657,1711,08148439000178,MUNICIPIO DE FRANCISCO DANTAS,REALIZAÇÃO DA MARCHA PARA JESUS,30022.0,0.0,
18031,1821,16928483000129,MUNICIPIO DE SAO JOAO DA PONTE,Construção de Praça,0.0,150000.0,
38226,4138,30984161000128,FUNDO MUNICIPAL DE EDUCACAO - FME,Contratação de empresa especializada para execução de finalização da Creche do Bairro Bom Jesus no Município de Ariquemes/RO e Contratação de empresa especializada para execução de reforma e ampliação da sede da Biblioteca Municipal no Município de Ariquemes/RO,0.0,4390000.0,
73011,396,07387343000108,MUNICIPIO DE BATURITE,PAVIMENTAÇÃO ASFÁLTICA NO MUNICÍPIO DE BATURITÉ/CE.,0.0,2350000.0,
4346,5605,83102699000128,MUNICIPIO DE PRESIDENTE NEREU,"Reurbanização do passeio da Rua 22 de Julho no município de Presidente Nereu, localizada no perímetro Urbano.",0.0,150000.0,
71667,1020,88370879000104,MUNICIPIO DE SAO SEBASTIAO DO CAI,Execução equipamentos para bombeiros.,0.0,200000.0,
69526,1019,27174051000196,MUNICIPIO DE MONTANHA,Regularização Fundiária no Município de Montanha/ES,0.0,2000000.0,
38820,16510,45299104000187,MUNICIPIO DE BATATAIS,"Recapeamento e recuperação da rede de drenagem da Via de acesso Jácomo Rampim, em perímetro urbano do município de Batatais/SP.",0.0,500000.0,
36786,28762,02391654000119,MUNICIPIO DE SAO MIGUEL DO ARAGUAIA,AQUISIÇÃO DE SISTEMA INTEGRADO LOUSA DIGITAL PARA PROJECAO COM SUPORTE E PROJETOR MULTIMIDIA DESTINADOS A ATENDER AS NECESSIDADES DA SECRETARIA MUNICIPAL DE EDUCAÇÃO CULTURA E ESPORTE.,0.0,600000.0,
72618,2178,01612388000144,MUNICIPIO DE ARAPUA,"CONTRATAÇÃO DE EMPRESA ESPECIALIZADA PARA A REVITALIZAÇÃO DA PRAÇA CENTRAL DO MUNICÍPIO, POR EMPREITADA POR PREÇO GLOBAL, COM FORNECIMENTO DE MATERIAIS E MÃO DE OBRA.",0.0,1000000.0,
